score,sentence_scores,text
0.9710440185708216,"[{'score': 9.128266603686264e-05, 'sentence': 'ROSES to actor Donal Logue, known for roles on everything from “ER” and “Grounded for Life” to “Sons of Anarchy.” But did you know he’s also a partner in a trucking company – Aisling Trucking out of Medford, Ore.? And that he has his own CDL?'}, {'score': 0.0018886467626354486, 'sentence': 'Not only that, but he loves to drive truck.'}, {'score': 0.00010287329838121195, 'sentence': 'Mr. Logue, you may be a fan of trucking, but we’re guessing you now have a few more truckers who are fans of yours.'}, {'score': 0.0, 'sentence': 'RAZZBERRIES to the state of Minnesota for using private receipts to enforce overweight restrictions after the fact.'}]","ROSES to actor Donal Logue, known for roles on everything from “ER” and “Grounded for Life” to “Sons of Anarchy.” But did you know he’s also a partner in a trucking company – Aisling Trucking out of Medford, Ore.? And that he has his own CDL? Not only that, but he loves to drive truck. Mr. Logue, you may be a fan of trucking, but we’re guessing you now have a few more truckers who are fans of yours. RAZZBERRIES to the state of Minnesota for using private receipts to enforce overweight restrictions after the fact."
0.9999868538777813,"[{'score': 0.0, 'sentence': 'LATROBE - Ainsley Battles is back in a Pittsburgh Steelers uniform.'}, {'score': 0.8539220321201952, 'sentence': 'Battles, a safety, was brought in as a free agent to provide depth in the defensive secondary.'}, {'score': 0.9865094174020798, 'sentence': 'Battles, who played his college ball at Vanderbilt, was one of the few undrafted rookie free agents to earn an opening day roster spot for the Steelers in 2000.'}, {'score': 0.9918410198228579, 'sentence': 'He spent two seasons with Pittsburgh and one with Jacksonville, playing in 45 games, starting 17, and intercepting three passes.'}, {'score': 0.004662893593320505, 'sentence': 'But, Battles lost his love for the game last year and quit just two weeks into training camp with the Buffalo Bills.'}]","LATROBE - Ainsley Battles is back in a Pittsburgh Steelers uniform. Battles, a safety, was brought in as a free agent to provide depth in the defensive secondary. Battles, who played his college ball at Vanderbilt, was one of the few undrafted rookie free agents to earn an opening day roster spot for the Steelers in 2000. He spent two seasons with Pittsburgh and one with Jacksonville, playing in 45 games, starting 17, and intercepting three passes. But, Battles lost his love for the game last year and quit just two weeks into training camp with the Buffalo Bills."
8.353891298717997e-07,"[{'score': 1.0683205616923708e-05, 'sentence': 'When George Orwell wrote â€œ1984â€\x9d he included a vision of the future in which people would converse in a language called.'}, {'score': 1.1601797689220206e-07, 'sentence': 'Orwell described Newspeak as “the only language in the world whose vocabulary gets smaller every year”.'}, {'score': 6.434949388012257e-06, 'sentence': 'Orwellâ€™s idea with Newspeak was to have a world where all shades of meaning were removed from language, which reinforced the total dominance of the State.'}, {'score': 1.725851894729402e-08, 'sentence': 'Calling something one thing when itâ€™s the exact opposite also might be an example of Orwellian Newspeak, like calling a bill full of spending on liberal social programs an economic stimulus plan.'}]","When George Orwell wrote â€œ1984â€ he included a vision of the future in which people would converse in a language called. Orwell described Newspeak as “the only language in the world whose vocabulary gets smaller every year”. Orwellâ€™s idea with Newspeak was to have a world where all shades of meaning were removed from language, which reinforced the total dominance of the State. Calling something one thing when itâ€™s the exact opposite also might be an example of Orwellian Newspeak, like calling a bill full of spending on liberal social programs an economic stimulus plan."
0.9999985585441842,"[{'score': 0.10138577737988863, 'sentence': 'A woman was threatened when she was approached by a stranger in a street in Lindfield yesterday afternoon.'}, {'score': 0.9966790734778154, 'sentence': 'Police say that the woman was walking along Barncroft Drive, Lindfield, between 4.45pm and 5.30pm yesterday when she was grabbed by a white bearded man in his late 40s or early 50s.'}, {'score': 3.6415315207705135e-14, 'sentence': 'The man made verbal threats to her but ran off after a group of about 15 teenagers walked into Barncroft Drive.'}, {'score': 0.9895078497387333, 'sentence': 'Police say the woman was not physically injured.'}, {'score': 0.9506311105599017, 'sentence': 'A spokesman said: “The investigation into this incident is at an early stage and the exact motive has not been established.'}]","A woman was threatened when she was approached by a stranger in a street in Lindfield yesterday afternoon. Police say that the woman was walking along Barncroft Drive, Lindfield, between 4.45pm and 5.30pm yesterday when she was grabbed by a white bearded man in his late 40s or early 50s. The man made verbal threats to her but ran off after a group of about 15 teenagers walked into Barncroft Drive. Police say the woman was not physically injured. A spokesman said: “The investigation into this incident is at an early stage and the exact motive has not been established."
0.9998985717133446,"[{'score': 2.971512936822407e-07, 'sentence': 'COUNTY and district councillor for Axminster, Cllr Ian Hall, has spoken out on his support for the recently agreed Axminster masterplan.'}, {'score': 0.00025484576314582785, 'sentence': 'Cllr Hall says he “makes no apology” for speaking out on what he believes to be a “once in a lifetime opportunity” for the town.'}, {'score': 0.00018717691596115138, 'sentence': 'His latest comments follow a decision by East Devon District Council’s strategic planning committee to support the masterplan, which sets out how the town should be developed.'}, {'score': 0.00407999187113528, 'sentence': 'Cllr Hall said: “The world around us is changing and we need to evolve as well if we are to avoid our town stagnating or dying.'}]","COUNTY and district councillor for Axminster, Cllr Ian Hall, has spoken out on his support for the recently agreed Axminster masterplan. Cllr Hall says he “makes no apology” for speaking out on what he believes to be a “once in a lifetime opportunity” for the town. His latest comments follow a decision by East Devon District Council’s strategic planning committee to support the masterplan, which sets out how the town should be developed. Cllr Hall said: “The world around us is changing and we need to evolve as well if we are to avoid our town stagnating or dying."
6.921418750582831e-06,"[{'score': 0.0007471737518737198, 'sentence': 'You have to admire Lego Cuusoo: The website does a great job at bringing a community of Lego fans together to create interesting designs for future sets.'}, {'score': 0.0015229638526130795, 'sentence': ""Who wouldn't encourage people of all ages to get creative?""}, {'score': 0.11186435879947987, 'sentence': ""Lego and the geek community go hand-in-hand though, so when Ladyada's workshop is pitched as a set, you can't help but get a little excited.""}, {'score': 4.6037595957670874e-10, 'sentence': 'Adafruit Industries makes and sells hardware that is easy to use (like specific Arduino kits) in order to inspire people of all ages and experience levels to work with electronics Naturally, this makes Ladyada and her company worthy contestants to be a Lego set.'}]","You have to admire Lego Cuusoo: The website does a great job at bringing a community of Lego fans together to create interesting designs for future sets. Who wouldn't encourage people of all ages to get creative? Lego and the geek community go hand-in-hand though, so when Ladyada's workshop is pitched as a set, you can't help but get a little excited. Adafruit Industries makes and sells hardware that is easy to use (like specific Arduino kits) in order to inspire people of all ages and experience levels to work with electronics Naturally, this makes Ladyada and her company worthy contestants to be a Lego set."
2.6146570841767414e-06,"[{'score': 0.00011297617763428303, 'sentence': ""Most Indians don't ride horses or wear feathers, but in the movies, they always do.""}, {'score': 0.0008052176706758729, 'sentence': 'Watch the story of the real mad men and women who changed the way we feel, see, and buy.'}, {'score': 4.440892098500626e-16, 'sentence': ""Trailblazer Mary Wells on making the ads of the '60s fun.""}, {'score': 0.0, 'sentence': 'Adman George Lois on advertising, Ali, and changing the world.'}, {'score': 0.0, 'sentence': 'Bill Bernbach -- the man who brought art and copy together in the agency.'}, {'score': 0.0, 'sentence': 'Hal Riney describes the innovative Saturn car campaign.'}, {'score': 4.218847493575595e-15, 'sentence': '""Welcome to the CPL, life in a nutshell.'}, {'score': 0.9215240602456803, 'sentence': 'Could be heaven, could be hell.""'}]","Most Indians don't ride horses or wear feathers, but in the movies, they always do. Watch the story of the real mad men and women who changed the way we feel, see, and buy. Trailblazer Mary Wells on making the ads of the '60s fun. Adman George Lois on advertising, Ali, and changing the world. Bill Bernbach -- the man who brought art and copy together in the agency. Hal Riney describes the innovative Saturn car campaign. ""Welcome to the CPL, life in a nutshell. Could be heaven, could be hell."""
2.8629613116892827e-06,"[{'score': 0.8357876864341748, 'sentence': 'If this was supposed to be a measuring stick game for the Flyers, they came up a bit short.'}, {'score': 0.0021323347365336254, 'sentence': 'Coming off a 12-1-1 dash since Jan. 12, the Flyers skated squarely into a wall named the Tampa Bay Lightning on Tuesday night and it was a reality check.'}, {'score': 0.9975734045240138, 'sentence': 'The team with the best record (46-11-4) in the NHL easily skated past the Flyers on the way to a 5-2 win at the Wells Fargo Center, sweeping the season series.'}, {'score': 0.4921211565943767, 'sentence': 'With Pittsburgh winning at New Jersey, the Flyers fell back to eight points out of a playoff spot again.'}]","If this was supposed to be a measuring stick game for the Flyers, they came up a bit short. Coming off a 12-1-1 dash since Jan. 12, the Flyers skated squarely into a wall named the Tampa Bay Lightning on Tuesday night and it was a reality check. The team with the best record (46-11-4) in the NHL easily skated past the Flyers on the way to a 5-2 win at the Wells Fargo Center, sweeping the season series. With Pittsburgh winning at New Jersey, the Flyers fell back to eight points out of a playoff spot again."
7.452927236473172e-07,"[{'score': 2.5689450566801497e-10, 'sentence': ""Part two of Naomi Klein's report on the events that triggered a momentous new kind of politics in Argentina.""}, {'score': 0.832221073552503, 'sentence': 'Up until quite recently, Argentina pursued a policy of official amnesia when it came to the crimes of the Dirty War.'}, {'score': 7.00323747437892e-07, 'sentence': 'Sure, the human rights non-governmental organisations still issued numerous scathing reports, the Mothers of the Plaza de Mayo still marched and the children of disappeared parents still showed up, from time to time, outside the homes of ex-military figures to throw red paint.'}, {'score': 3.950642946115579e-07, 'sentence': 'But before the Argentinazo, most middle-class Argentinians regarded such actions as macabre rituals from a bygone era.'}]","Part two of Naomi Klein's report on the events that triggered a momentous new kind of politics in Argentina. Up until quite recently, Argentina pursued a policy of official amnesia when it came to the crimes of the Dirty War. Sure, the human rights non-governmental organisations still issued numerous scathing reports, the Mothers of the Plaza de Mayo still marched and the children of disappeared parents still showed up, from time to time, outside the homes of ex-military figures to throw red paint. But before the Argentinazo, most middle-class Argentinians regarded such actions as macabre rituals from a bygone era."
0.0007119614768911209,"[{'score': 0.0010123285267650273, 'sentence': 'January 6, 2017 Affordable Care Act, health insurance, Uncategorized.'}, {'score': 0.936748008857974, 'sentence': 'A new poll released Friday finds one in five voters want the Affordable Care Act repealed before a replacement plan is ready, highlighting challenges for a new Congress.'}, {'score': 0.0, 'sentence': 'Incoming president Donald Trump tweeted to GOP legislators “be careful” earlier this week.'}, {'score': 0.01147837490447301, 'sentence': 'To break it down, 20 percent of people surveyed want it gone immediately with details worked out later, while another 28 percent say wait to repeal until a replacement plan has been announced, the Kaiser Family Foundation said.'}]","January 6, 2017 Affordable Care Act, health insurance, Uncategorized. A new poll released Friday finds one in five voters want the Affordable Care Act repealed before a replacement plan is ready, highlighting challenges for a new Congress. Incoming president Donald Trump tweeted to GOP legislators “be careful” earlier this week. To break it down, 20 percent of people surveyed want it gone immediately with details worked out later, while another 28 percent say wait to repeal until a replacement plan has been announced, the Kaiser Family Foundation said."
0.009060686872911061,"[{'score': 0.6723098488057488, 'sentence': 'South Dade will be looking to win its sixth straight Class 3A state title this weekend.'}, {'score': 2.1548091111434076e-07, 'sentence': 'South Dade enters the FHSAA state wrestling tournament this weekend as the favorite to win a sixth-straight Class 3A team title, but not as big a favorite as they’ve been in recent seasons.'}, {'score': 0.0, 'sentence': 'Leading the way for the Bucs are returning state champions Bretli Reyna, Brevin Balmeceda, and Todd Perry.'}, {'score': 0.0, 'sentence': 'Tyler Orta, Joshua Swan, and Eric Temes have finished on the podium before and their performances this weekend will go a long way toward assuring South Dade wins another team title.'}]","South Dade will be looking to win its sixth straight Class 3A state title this weekend. South Dade enters the FHSAA state wrestling tournament this weekend as the favorite to win a sixth-straight Class 3A team title, but not as big a favorite as they’ve been in recent seasons. Leading the way for the Bucs are returning state champions Bretli Reyna, Brevin Balmeceda, and Todd Perry. Tyler Orta, Joshua Swan, and Eric Temes have finished on the podium before and their performances this weekend will go a long way toward assuring South Dade wins another team title."
8.187360234224172e-07,"[{'score': 0.0020049431862652067, 'sentence': 'At NSE, shares of Nestle climbed 5.35 per cent to Rs 6,185.05.'}, {'score': 9.40748191105012e-05, 'sentence': 'At BSE the stocks surged by 5.23 per cent to Rs 6,180.'}, {'score': 0.0, 'sentence': 'Share prices of Nestle climbed after the CFTRI report stated that led levels in Maggi were under permissible limits.'}, {'score': 0.005487397974866193, 'sentence': 'Nestle jumped over 5 per cent after the FMCG major said its popular product Maggi cleared tests conducted by Central Food Technological Research Institute (CFTRI) under the directive of Supreme Court, reiterating that the instant noodles brand is safe for consumption.'}, {'score': 8.054800904666592e-05, 'sentence': 'The stock after making a positive opening, jumped further by 5.23 per cent to Rs 6,180 on BSE.'}]","At NSE, shares of Nestle climbed 5.35 per cent to Rs 6,185.05. At BSE the stocks surged by 5.23 per cent to Rs 6,180. Share prices of Nestle climbed after the CFTRI report stated that led levels in Maggi were under permissible limits. Nestle jumped over 5 per cent after the FMCG major said its popular product Maggi cleared tests conducted by Central Food Technological Research Institute (CFTRI) under the directive of Supreme Court, reiterating that the instant noodles brand is safe for consumption. The stock after making a positive opening, jumped further by 5.23 per cent to Rs 6,180 on BSE."
0.0002994901042873144,"[{'score': 0.030204556696427853, 'sentence': 'Rep. Francis D. Gibson speaks on the Utah Inland Port Authority Bill that he sponsored as Utah Legislators gather at the State Capitol in Salt Lake City for a special session on Wednesday, July 18, 2018.'}, {'score': 2.220446049250313e-15, 'sentence': 'Just because something is allowed doesn’t mean it is advisable.'}, {'score': 2.1782575743145571e-13, 'sentence': 'The three subcommittees of the Utah Inland Port Authority Board may legally meet behind closed doors under the state’s Open and Public Meetings Act.'}, {'score': 2.19957385638736e-12, 'sentence': 'Each subcommittee consists of four or five members of the 11-member Port Authority board, which doesn’t constitute a quorum.'}]","Rep. Francis D. Gibson speaks on the Utah Inland Port Authority Bill that he sponsored as Utah Legislators gather at the State Capitol in Salt Lake City for a special session on Wednesday, July 18, 2018. Just because something is allowed doesn’t mean it is advisable. The three subcommittees of the Utah Inland Port Authority Board may legally meet behind closed doors under the state’s Open and Public Meetings Act. Each subcommittee consists of four or five members of the 11-member Port Authority board, which doesn’t constitute a quorum."
0.9999968794999997,"[{'score': 0.2378306500464903, 'sentence': '“The Monterey Bay has always been a great place to visit for its beautiful scenery.'}, {'score': 4.1595985100784105e-08, 'sentence': 'Now you can come for the beer!""'}, {'score': 0.9999962733607158, 'sentence': 'Jeff Moses, owner of Night That Never Ends Productions, is hosting the 2011 Monterey Beer Festival, which is being billed as “the greatest assortment of beer ever assembled on the Central Coast.” On Saturday afternoon, June 11, more than 80 brewers will be pouring hundreds of the best beers from around the world.'}, {'score': 0.001967678133934725, 'sentence': 'Monterey area chefs will make a wide variety of food available and live music will play throughout the day.'}]","“The Monterey Bay has always been a great place to visit for its beautiful scenery. Now you can come for the beer!"" Jeff Moses, owner of Night That Never Ends Productions, is hosting the 2011 Monterey Beer Festival, which is being billed as “the greatest assortment of beer ever assembled on the Central Coast.” On Saturday afternoon, June 11, more than 80 brewers will be pouring hundreds of the best beers from around the world. Monterey area chefs will make a wide variety of food available and live music will play throughout the day."
6.681770989391822e-05,"[{'score': 3.148592497836944e-13, 'sentence': 'A rumored-to-be pregnant Kylie Jenner was finally caught in public.'}, {'score': 0.7211498526236673, 'sentence': 'The 20-year-old was spotted at a construction site in Hidden Hills on Wednesday in a baggy black sweatshirt and sweatpants, accompanied by her best pal Jordyn Woods and Kris Jenner, TMZ reported.'}, {'score': 0.9429211607345286, 'sentence': ""The Kardashian-Jenner family has yet to confirm Kylie's pregnancy, but multiple outlets, including TMZ, said she was about five months pregnant and expecting a girl with boyfriend Travis Scott back in September.""}, {'score': 8.54830091157055e-08, 'sentence': 'Jenner did appear in a Calvin Klein ad along with her sisters last week, but her stomach was covered as to not show off a possible baby bump.'}]","A rumored-to-be pregnant Kylie Jenner was finally caught in public. The 20-year-old was spotted at a construction site in Hidden Hills on Wednesday in a baggy black sweatshirt and sweatpants, accompanied by her best pal Jordyn Woods and Kris Jenner, TMZ reported. The Kardashian-Jenner family has yet to confirm Kylie's pregnancy, but multiple outlets, including TMZ, said she was about five months pregnant and expecting a girl with boyfriend Travis Scott back in September. Jenner did appear in a Calvin Klein ad along with her sisters last week, but her stomach was covered as to not show off a possible baby bump."
0.9895755830220878,"[{'score': 2.220446049250313e-16, 'sentence': 'New York City Mayor Bill de Blasio isn’t visiting Israel until August.'}, {'score': 2.90656387846866e-13, 'sentence': 'But that doesn’t mean he can’t hold hands and dance with Hasidic Jews before then.'}, {'score': 0.002285021918543073, 'sentence': 'The mayor may not have known all the words, but as the video below shows, he certainly got into the spirit of “Hevenu Shalom Aleichem” and “Am Yisrael Chai” at Sunday’s “Celebrate Israel” parade in New York.'}, {'score': 0.0, 'sentence': 'He’s hardly the first politician to dance with Chabad — you can watch Texas Gov.'}]","New York City Mayor Bill de Blasio isn’t visiting Israel until August. But that doesn’t mean he can’t hold hands and dance with Hasidic Jews before then. The mayor may not have known all the words, but as the video below shows, he certainly got into the spirit of “Hevenu Shalom Aleichem” and “Am Yisrael Chai” at Sunday’s “Celebrate Israel” parade in New York. He’s hardly the first politician to dance with Chabad — you can watch Texas Gov."
9.853392839431763e-07,"[{'score': 0.9930317944604827, 'sentence': ""Members of Lubbock's Muslim community reacted with surprise and dismay at the news of the Feb. 23 arrest of Saudi-born Lubbock resident Khalid Ali-M Aldawsari on charges of attempted use of a weapon of mass destruction.""}, {'score': 1.009208272506612e-10, 'sentence': 'Imam Samer Altabaa of the Islamic Center of the South Plains had just begun to contact people in the Saudi community when contacted for comment Feb. 24.'}, {'score': 0.9887504017077154, 'sentence': 'He said he did not know Aldawsari and had not heard of him before the arrest.'}, {'score': 0.013288109646103052, 'sentence': 'He also said that no one in the Saudi community seemed to know Aldawsari, who identified as Muslim on his Facebook page.'}]","Members of Lubbock's Muslim community reacted with surprise and dismay at the news of the Feb. 23 arrest of Saudi-born Lubbock resident Khalid Ali-M Aldawsari on charges of attempted use of a weapon of mass destruction. Imam Samer Altabaa of the Islamic Center of the South Plains had just begun to contact people in the Saudi community when contacted for comment Feb. 24. He said he did not know Aldawsari and had not heard of him before the arrest. He also said that no one in the Saudi community seemed to know Aldawsari, who identified as Muslim on his Facebook page."
0.001530324606070832,"[{'score': 0.0, 'sentence': 'Gaza is the world’s biggest prison.'}, {'score': 0.0, 'sentence': 'Nearly two million Palestinian people are locked up there by Israel’s military blockade.'}, {'score': 0.8449707559079437, 'sentence': 'Last year, racist Israel killed over 2,000 Palestinians in Gaza, including 547 children.'}, {'score': 0.0, 'sentence': 'The Pentagon rushed in more bombs when the Zionist state ran low on \xadammunition.'}, {'score': 8.303186027625031e-09, 'sentence': 'Baltimore, similar to Palestine, is under a racist military occupation.'}, {'score': 0.43809815429143995, 'sentence': 'The Baltimore police force — the sixth largest in the 26th largest U.S. city — treats Black people like prisoners.'}, {'score': 0.9995867717597395, 'sentence': 'According to the 2010 U.S. census, while 72 percent of the Baltimore population are people of color, 46 percent of the police are white.'}]","Gaza is the world’s biggest prison. Nearly two million Palestinian people are locked up there by Israel’s military blockade. Last year, racist Israel killed over 2,000 Palestinians in Gaza, including 547 children. The Pentagon rushed in more bombs when the Zionist state ran low on ­ammunition. Baltimore, similar to Palestine, is under a racist military occupation. The Baltimore police force — the sixth largest in the 26th largest U.S. city — treats Black people like prisoners. According to the 2010 U.S. census, while 72 percent of the Baltimore population are people of color, 46 percent of the police are white."
