score,sentence_scores,text
4.211493900840857e-06,"[{'score': 0.0, 'sentence': 'There’s a Speed Graphic camera, once standard equipment in newsrooms across the country.'}, {'score': 0.0, 'sentence': 'You may have seen them in 1930s and ’40s-era movies that featured gaggles of photographers, “Press” placards stuck in there fedora hatbands.'}, {'score': 0.00010076568428396548, 'sentence': 'Heavy, bulky and requiring light-bulb-sized flashbulbs to shoot at night, a Speed Graphic was the first camera I used professionally, for my high-school yearbook and the paper I worked for part-time while in high school and college.'}, {'score': 0.0, 'sentence': 'The one in my office used sheet film -- you’d take a shot, pull out the sheet holder, put in another.'}]","There’s a Speed Graphic camera, once standard equipment in newsrooms across the country. You may have seen them in 1930s and ’40s-era movies that featured gaggles of photographers, “Press” placards stuck in there fedora hatbands. Heavy, bulky and requiring light-bulb-sized flashbulbs to shoot at night, a Speed Graphic was the first camera I used professionally, for my high-school yearbook and the paper I worked for part-time while in high school and college. The one in my office used sheet film -- you’d take a shot, pull out the sheet holder, put in another."
0.00027829143736102235,"[{'score': 1.4481749133210542e-12, 'sentence': 'Anyone who’s ever been frustrated at the task of shooting video in low light should be poised to freak out over Canon’s weird and amazing new camera.'}, {'score': 0.0, 'sentence': 'It’s a video camera that shoots full HD color footage in almost complete darkness.'}, {'score': 2.220446049250313e-16, 'sentence': 'The ‘multi-purpose’ camera, dubbed only MH20F-SH, has a full-frame sensor with 2.26 megapixels.'}, {'score': 0.0008835575637184956, 'sentence': 'The reason for the meager resolution is because each pixel is very large—19 microns to be exact.'}, {'score': 6.685874076595155e-11, 'sentence': 'That’s 7.5x larger than, say, the pixels found on a flagship DSLR like the Canon 1Dx.'}]","Anyone who’s ever been frustrated at the task of shooting video in low light should be poised to freak out over Canon’s weird and amazing new camera. It’s a video camera that shoots full HD color footage in almost complete darkness. The ‘multi-purpose’ camera, dubbed only MH20F-SH, has a full-frame sensor with 2.26 megapixels. The reason for the meager resolution is because each pixel is very large—19 microns to be exact. That’s 7.5x larger than, say, the pixels found on a flagship DSLR like the Canon 1Dx."
1.8693704521011156e-06,"[{'score': 0.0, 'sentence': 'Is our efficient Tax Office killing this country?'}, {'score': 1.3322676295501878e-15, 'sentence': 'I’ve never seen a story where the Reserve Bank was urging the Government to give tax cuts.'}, {'score': 1.434056651206106e-09, 'sentence': 'But that’s exactly what’s happening now, which partly explains why our economy is going off the boil.'}, {'score': 8.476971931070665e-07, 'sentence': 'In fact, the implication from this historically unusual tale is that the Tax Commissioner, Chris Jordan and his team have been doing such a great job cracking down on excessive deductions claims, especially from business.'}, {'score': 0.0, 'sentence': 'Because of the productivity delivered via computer technology, the tax take for Government is surging.'}]","Is our efficient Tax Office killing this country? I’ve never seen a story where the Reserve Bank was urging the Government to give tax cuts. But that’s exactly what’s happening now, which partly explains why our economy is going off the boil. In fact, the implication from this historically unusual tale is that the Tax Commissioner, Chris Jordan and his team have been doing such a great job cracking down on excessive deductions claims, especially from business. Because of the productivity delivered via computer technology, the tax take for Government is surging."
0.006122599232871617,"[{'score': 0.0, 'sentence': 'A facility manager wears many hats.'}, {'score': 3.121769509562e-11, 'sentence': 'It isn’t uncommon for a facility manager to lead a meeting, provide plumbing advice, present a renovation proposal and ensure that the floors are cleaned properly – all in one day.'}, {'score': 0.0504157589640265, 'sentence': 'Facility managers take into account the safety and health of all building users, as they consider how a facility runs.'}, {'score': 0.000715872068735135, 'sentence': 'A strong background in management, technical skills, construction fundamentals and technology is needed to be a successful facility manager.'}, {'score': 0.0, 'sentence': 'A facility manager provides oversight for the physical plant of a building or structural campus.'}]","A facility manager wears many hats. It isn’t uncommon for a facility manager to lead a meeting, provide plumbing advice, present a renovation proposal and ensure that the floors are cleaned properly – all in one day. Facility managers take into account the safety and health of all building users, as they consider how a facility runs. A strong background in management, technical skills, construction fundamentals and technology is needed to be a successful facility manager. A facility manager provides oversight for the physical plant of a building or structural campus."
0.0002919774630973926,"[{'score': 0.7203277303167008, 'sentence': 'A communications professor at Texas A&M University wanted to find out about the effects of changes to the newspaper industry on our nation’s politics, so she did some research, which has been published in the Journal of Communication.'}, {'score': 0.9995166404894191, 'sentence': 'If you have noticed what seems like a sharp increase in political polarization in the past few years, you are not imagining things.'}, {'score': 3.372332878781581e-05, 'sentence': 'And, as Johanna Dunaway, and some colleagues at Colorado State and Louisiana State universities, found out, that polarization happened during a period of steady decrease in the number of local newspapers and journalists across the country.'}]","A communications professor at Texas A&M University wanted to find out about the effects of changes to the newspaper industry on our nation’s politics, so she did some research, which has been published in the Journal of Communication. If you have noticed what seems like a sharp increase in political polarization in the past few years, you are not imagining things. And, as Johanna Dunaway, and some colleagues at Colorado State and Louisiana State universities, found out, that polarization happened during a period of steady decrease in the number of local newspapers and journalists across the country."
1.285345323620568e-06,"[{'score': 1.404661911774685e-05, 'sentence': 'WASHINGTON -- An Iowa egg producer at the center of a nationwide outbreak of salmonella apologized to a Congressional panel on Wednesday and admitted that his family operation ""got big quite a while before we stopped acting like we were small.""'}, {'score': 0.023194299059425827, 'sentence': '""What I mean by that is we were big before we started adopting sophisticated procedures to be sure we met all of the government requirements,"" the egg producer, Austin J. DeCoster, said in testimony before a House Energy and Commerce subcommittee.'}, {'score': 0.0029779164495320476, 'sentence': 'He is the founder of an egg empire that has been linked over three decades to multiple deadly outbreaks of salmonella poisoning in many states.'}]","WASHINGTON -- An Iowa egg producer at the center of a nationwide outbreak of salmonella apologized to a Congressional panel on Wednesday and admitted that his family operation ""got big quite a while before we stopped acting like we were small."" ""What I mean by that is we were big before we started adopting sophisticated procedures to be sure we met all of the government requirements,"" the egg producer, Austin J. DeCoster, said in testimony before a House Energy and Commerce subcommittee. He is the founder of an egg empire that has been linked over three decades to multiple deadly outbreaks of salmonella poisoning in many states."
8.466916207039432e-07,"[{'score': 0.3149335948446862, 'sentence': 'A CONSERVATIVE candidate standing in the local election has been suspended from the party after failing to declare a pending drink-driving court case, where he was later convicted.'}, {'score': 9.336663677750323e-07, 'sentence': 'Ben Wong, 48, of South Dragon House takeaway on Silver Street, put his name forward to stand in the Victoria ward in the May 2 elections under the Conservative party, but has since been suspended following his conviction.'}, {'score': 5.861226331060898e-06, 'sentence': ""Nominations closed to stand for election on April 3, but he stood trial at Taunton Magistrates' Court on March 21 - something the local Somerset Conservatives were unaware of.""}]","A CONSERVATIVE candidate standing in the local election has been suspended from the party after failing to declare a pending drink-driving court case, where he was later convicted. Ben Wong, 48, of South Dragon House takeaway on Silver Street, put his name forward to stand in the Victoria ward in the May 2 elections under the Conservative party, but has since been suspended following his conviction. Nominations closed to stand for election on April 3, but he stood trial at Taunton Magistrates' Court on March 21 - something the local Somerset Conservatives were unaware of."
0.9981408240273595,"[{'score': 0.0, 'sentence': 'Battfleck is officially no more!'}, {'score': 0.8567446576378172, 'sentence': 'Ben Affleck is officially out as Bruce Wayne in The Batman.'}, {'score': 0.9884501934374719, 'sentence': 'And he is passing the torch to a new actor, who has yet to be cast.'}, {'score': 0.985058403577053, 'sentence': 'Warner Bros. announced the official release date for The Batman earlier today, with the standalone DC adventure set to arrive on June 25, 2021.'}, {'score': 0.9911218165369805, 'sentence': 'Shortly after the news was announced, Ben Affleck jumped on social media to wish director Matt Reeves well with taking the caped crusader into the future.'}, {'score': 0.00011311286227133621, 'sentence': ""The tweet was later confirmed to be Ben Affleck's goodbye to the character.""}]","Battfleck is officially no more! Ben Affleck is officially out as Bruce Wayne in The Batman. And he is passing the torch to a new actor, who has yet to be cast. Warner Bros. announced the official release date for The Batman earlier today, with the standalone DC adventure set to arrive on June 25, 2021. Shortly after the news was announced, Ben Affleck jumped on social media to wish director Matt Reeves well with taking the caped crusader into the future. The tweet was later confirmed to be Ben Affleck's goodbye to the character."
1.1700850266471718e-06,"[{'score': 0.11509140396811901, 'sentence': ""It's customary to leave a tip when eating out, but one particular gratuity added to an order for a milkshake and fries at a New Jersey diner is angering parents.""}, {'score': 0.08341951424599603, 'sentence': '""My daughter was coming to me, telling me that every time she and her friends went to the diner, they\'re being charged the gratuity,"" said Melissa Desch.'}, {'score': 0.9992415793278219, 'sentence': '""And when I asked her why, she said, \'Because they\'re children.\'""'}, {'score': 6.384333625097938e-07, 'sentence': 'Desch said her daughter Isabella and other students at the Colfax Schuyler Middle School frequently go to the Wayne Hills Diner, just across the Hamburg Turnpike from the school.'}]","It's customary to leave a tip when eating out, but one particular gratuity added to an order for a milkshake and fries at a New Jersey diner is angering parents. ""My daughter was coming to me, telling me that every time she and her friends went to the diner, they're being charged the gratuity,"" said Melissa Desch. ""And when I asked her why, she said, 'Because they're children.'"" Desch said her daughter Isabella and other students at the Colfax Schuyler Middle School frequently go to the Wayne Hills Diner, just across the Hamburg Turnpike from the school."
1.772182194215155e-06,"[{'score': 0.9073062863223373, 'sentence': 'DALLAS - Like many Americans, Martin Jacobson was overjoyed that Navy SEALs had captured and killed Osama bin Laden.'}, {'score': 0.9414742849901651, 'sentence': 'But the Dallas resident felt a deeper connection to the men who hunted down the mastermind of the Sept. 11, 2001, terrorist attacks.'}, {'score': 0.9989249274260272, 'sentence': 'Decades ago, he was one of them.'}, {'score': 2.2616033451883233e-05, 'sentence': 'During World War II, Jacobson was part of elite groups that were predecessors to the SEALs.'}, {'score': 6.347368797987585e-05, 'sentence': ""The secretive force is used to staying out of the spotlight, but it's back in the headlines following the bin Laden killing.""}, {'score': 0.039939179119282686, 'sentence': '""I\'m just proud of the SEALs,"" said Jacobson, 89.'}]","DALLAS - Like many Americans, Martin Jacobson was overjoyed that Navy SEALs had captured and killed Osama bin Laden. But the Dallas resident felt a deeper connection to the men who hunted down the mastermind of the Sept. 11, 2001, terrorist attacks. Decades ago, he was one of them. During World War II, Jacobson was part of elite groups that were predecessors to the SEALs. The secretive force is used to staying out of the spotlight, but it's back in the headlines following the bin Laden killing. ""I'm just proud of the SEALs,"" said Jacobson, 89."
7.327543486423949e-07,"[{'score': 0.056983086253401316, 'sentence': 'Northern Ireland was today branded the race hate capital of Europe, in a report on racist violence in the province.'}, {'score': 0.9980537107245099, 'sentence': 'Human rights campaigner Doreen Lawrence, mother of murdered black teenager Stephen Lawrence, was in Belfast for the launch of the report by the Northern Ireland Council for Ethnic Minorities (NICEM).'}, {'score': 0.8374655470516541, 'sentence': 'The report identified institutionalised racism in the criminal justice system and asked how it should be addressed.'}, {'score': 0.9516980479559055, 'sentence': 'Racist violence has been growing in Northern Ireland in recent years, not just against blacks and Asians, but almost anyone considered an outsider.'}]","Northern Ireland was today branded the race hate capital of Europe, in a report on racist violence in the province. Human rights campaigner Doreen Lawrence, mother of murdered black teenager Stephen Lawrence, was in Belfast for the launch of the report by the Northern Ireland Council for Ethnic Minorities (NICEM). The report identified institutionalised racism in the criminal justice system and asked how it should be addressed. Racist violence has been growing in Northern Ireland in recent years, not just against blacks and Asians, but almost anyone considered an outsider."
1.5486930978747537e-06,"[{'score': 0.00016205770504262862, 'sentence': 'About 300 villagers from Kandal province locked in land disputes with private companies delivered petitions to embassies in Phnom Penh yesterday, before protesting in front of the provincial hall and calling for Prime Minister Hun Sen to help them.'}, {'score': 7.10647144464005e-08, 'sentence': 'Villagers told the Post they wanted an end to land disputes caused by companies that had “seized their land”, adding that they would “rather die” than go home without a result.'}, {'score': 3.8969716342762695e-11, 'sentence': 'They said authorities had ignored their pleas for help while the companies had used the court system to have villagers who complained about the acquisitions arrested.'}]","About 300 villagers from Kandal province locked in land disputes with private companies delivered petitions to embassies in Phnom Penh yesterday, before protesting in front of the provincial hall and calling for Prime Minister Hun Sen to help them. Villagers told the Post they wanted an end to land disputes caused by companies that had “seized their land”, adding that they would “rather die” than go home without a result. They said authorities had ignored their pleas for help while the companies had used the court system to have villagers who complained about the acquisitions arrested."
0.9999989754700209,"[{'score': 3.60883078304175e-05, 'sentence': 'The incline bench press is a strength-training move to build your chest and fronts of the shoulders.'}, {'score': 2.0046186932631826e-12, 'sentence': 'The move is performed in a face-up position on a workout bench set at an angle.'}, {'score': 0.07907083512291813, 'sentence': 'You then grasp dumbbells or a barbell in an overhand position, and extend and bend your elbows to elevate the weight over your chest.'}, {'score': 1.8469670237664104e-12, 'sentence': 'Incline chest press machines that simulate the movement in a fixed plane are another way to perform the move.'}, {'score': 0.7170776691585655, 'sentence': 'The incline press is one of several exercises that help create symmetry and strength in the muscles of the upper body.'}]","The incline bench press is a strength-training move to build your chest and fronts of the shoulders. The move is performed in a face-up position on a workout bench set at an angle. You then grasp dumbbells or a barbell in an overhand position, and extend and bend your elbows to elevate the weight over your chest. Incline chest press machines that simulate the movement in a fixed plane are another way to perform the move. The incline press is one of several exercises that help create symmetry and strength in the muscles of the upper body."
9.71858784337698e-07,"[{'score': 0.004640630032612725, 'sentence': 'JURGEN KLOPP has revealed his delight at ending Pep Guardiola\'s 22-game unbeaten run with Manchester City, exclaiming live on air: ""What the f**k was that?!"" And the Liverpool boss also blasted critics taking aim at his leaky defence, adding: ""Blow up my boots!""'}, {'score': 0.0745913161936761, 'sentence': 'Klopp was on cloud nine after masterminding a breathless 4-3 win over the title favourites at Anfield this morning.'}, {'score': 0.8980316490628981, 'sentence': 'A second-half blitz saw Liverpool race into a 4-1 lead before City grabbed two late goals to set up a nervy ending.'}]","JURGEN KLOPP has revealed his delight at ending Pep Guardiola's 22-game unbeaten run with Manchester City, exclaiming live on air: ""What the f**k was that?!"" And the Liverpool boss also blasted critics taking aim at his leaky defence, adding: ""Blow up my boots!"" Klopp was on cloud nine after masterminding a breathless 4-3 win over the title favourites at Anfield this morning. A second-half blitz saw Liverpool race into a 4-1 lead before City grabbed two late goals to set up a nervy ending."
1.0398255676502544e-06,"[{'score': 0.9065803740613456, 'sentence': ""Nobody asked me, but … if you pay dues to a neo-Nazi organization, subscribe to racist publications, buy tickets to a Holocaust denial conference and have a Holocaust denial DVD in your video collection, then you're probably a neo-Nazi.""}, {'score': 0.9769480716493215, 'sentence': 'That does not mean you are once and for all a neo-Nazi.'}, {'score': 0.9930361847823745, 'sentence': 'You can have a change of heart and a change of mind, and come clean.'}, {'score': 0.9996339334207281, 'sentence': 'If you want people to believe you are no longer a neo-Nazi, you have a lot of convincing to do.'}, {'score': 3.20226953454128e-06, 'sentence': 'It takes a lot of work to shake the brown shirt.'}]","Nobody asked me, but … if you pay dues to a neo-Nazi organization, subscribe to racist publications, buy tickets to a Holocaust denial conference and have a Holocaust denial DVD in your video collection, then you're probably a neo-Nazi. That does not mean you are once and for all a neo-Nazi. You can have a change of heart and a change of mind, and come clean. If you want people to believe you are no longer a neo-Nazi, you have a lot of convincing to do. It takes a lot of work to shake the brown shirt."
8.42547012602779e-07,"[{'score': 3.49194007043252e-11, 'sentence': ""THE first acknowledgement of Brent Moloney's redemption for an after-match drinking binge came midway through the season when he was quietly reinstated to the club's leadership group.""}, {'score': 0.10988101049912635, 'sentence': ""The second, much more public and significant than the first, came last night when he won Melbourne's best and fairest award.""}, {'score': 0.0, 'sentence': ""Moloney, 27, claimed the Keith ''Bluey'' Truscott Trophy ahead of key defenders Jared Rivers and James Frawley at a function at Crown Palladium.""}, {'score': 0.001983012273067075, 'sentence': ""Two of Moloney's midfield teammates, Nathan Jones and Jack Trengove, were fourth and fifth respectively.""}]","THE first acknowledgement of Brent Moloney's redemption for an after-match drinking binge came midway through the season when he was quietly reinstated to the club's leadership group. The second, much more public and significant than the first, came last night when he won Melbourne's best and fairest award. Moloney, 27, claimed the Keith ''Bluey'' Truscott Trophy ahead of key defenders Jared Rivers and James Frawley at a function at Crown Palladium. Two of Moloney's midfield teammates, Nathan Jones and Jack Trengove, were fourth and fifth respectively."
0.0003821970970649957,"[{'score': 0.9958134623039337, 'sentence': 'The Weeknd will team up with Daft Punk for a performance at the Grammy Awards.'}, {'score': 0.9995318047151313, 'sentence': 'LOS ANGELES (AP) — The Weeknd will team up with Daft Punk for a performance at the Grammy Awards.'}, {'score': 0.20188543438665785, 'sentence': 'The collaboration between the singer and the electronic music duo is one of a number of pairings announced Tuesday.'}, {'score': 0.3758069065102604, 'sentence': 'Anderson .Paak will take the stage with A Tribe Called Quest and Dave Grohl.'}, {'score': 2.220446049250313e-15, 'sentence': 'Maren Morris is set to perform with Alicia Keys.'}, {'score': 0.9894608393470826, 'sentence': 'The Grammys previously announced that Adele, John Legend, Bruno Mars, Metallica, Carrie Underwood and Keith Urban would perform.'}]","The Weeknd will team up with Daft Punk for a performance at the Grammy Awards. LOS ANGELES (AP) — The Weeknd will team up with Daft Punk for a performance at the Grammy Awards. The collaboration between the singer and the electronic music duo is one of a number of pairings announced Tuesday. Anderson .Paak will take the stage with A Tribe Called Quest and Dave Grohl. Maren Morris is set to perform with Alicia Keys. The Grammys previously announced that Adele, John Legend, Bruno Mars, Metallica, Carrie Underwood and Keith Urban would perform."
1.3805204822636696e-06,"[{'score': 0.05269278562999957, 'sentence': 'DARTMOUTH — On June 14, Flag Day, the students of the James M. Quinn Elementary School in Dartmouth gathered outside to celebrate Flag Day.'}, {'score': 0.9769998822912676, 'sentence': 'This in itself is not unusual, but this year it took on a more personal meaning.'}, {'score': 0.0, 'sentence': ""The reason being is that Dr. Carol Karafotis' cousin, Ted Cote from New Bedford is serving in Iraq.""}, {'score': 2.450812329746199e-07, 'sentence': ""Earlier in the year around Veteran's Day, Dr. Karafotis asked her students to send cards to Staff Sergeant Cote in order to cheer him up.""}, {'score': 0.0, 'sentence': 'The students responded and made cards that were then sent to Iraq.'}]","DARTMOUTH — On June 14, Flag Day, the students of the James M. Quinn Elementary School in Dartmouth gathered outside to celebrate Flag Day. This in itself is not unusual, but this year it took on a more personal meaning. The reason being is that Dr. Carol Karafotis' cousin, Ted Cote from New Bedford is serving in Iraq. Earlier in the year around Veteran's Day, Dr. Karafotis asked her students to send cards to Staff Sergeant Cote in order to cheer him up. The students responded and made cards that were then sent to Iraq."
9.218851725334432e-07,"[{'score': 0.0, 'sentence': 'Will UBS Tap Bob McCann Or Sallie Krawcheck For Top Wealth Management Job?'}, {'score': 0.0039539835218953545, 'sentence': ""Former Merill Lynch brokerage head Bob McCann and former Citigroup wealth management bosslady Sallie Krawcheck are both under consideration to take over the top job at UBS's wealth management unit.""}, {'score': 0.0, 'sentence': 'Investment News reported that two industry recruiters say both names are ""already circulating.""'}, {'score': 0.07018401519859208, 'sentence': ""Earlier, the Financial Times had reported the UBS new chief executive, Oswald Grubel, had decided not to sell the company's US wealth management business yet, despite speculation in recent months that he might offload this business following tax-evasion accusations and the ensuing scandal.""}]","Will UBS Tap Bob McCann Or Sallie Krawcheck For Top Wealth Management Job? Former Merill Lynch brokerage head Bob McCann and former Citigroup wealth management bosslady Sallie Krawcheck are both under consideration to take over the top job at UBS's wealth management unit. Investment News reported that two industry recruiters say both names are ""already circulating."" Earlier, the Financial Times had reported the UBS new chief executive, Oswald Grubel, had decided not to sell the company's US wealth management business yet, despite speculation in recent months that he might offload this business following tax-evasion accusations and the ensuing scandal."
