score,sentence_scores,text,error
0.9999829759611477,"[{'score': 0.8759998227298929, 'sentence': 'A man has been jailed for keeping dogs for fighting at his home in Ayrshire.'}, {'score': 0.9994616117029006, 'sentence': 'Tony Barbara, 50, was sentenced to 18 months in prison after being found guilty of animal cruelty.'}, {'score': 0.012024514078266879, 'sentence': 'The court was told that police found several dogs in horrific conditions, with visible injuries consistent with them being used for dog fighting.'}, {'score': 0.9985600797475009, 'sentence': 'The dogs were immediately removed from the premises and placed in the care of animal welfare organisations.'}, {'score': 0.9919537800663285, 'sentence': ""Barbara's sentence sends a clear message that animal cruelty will not be tolerated and those found guilty will face serious consequences.""}]","A man has been jailed for keeping dogs for fighting at his home in Ayrshire. Tony Barbara, 50, was sentenced to 18 months in prison after being found guilty of animal cruelty. The court was told that police found several dogs in horrific conditions, with visible injuries consistent with them being used for dog fighting. The dogs were immediately removed from the premises and placed in the care of animal welfare organisations. Barbara's sentence sends a clear message that animal cruelty will not be tolerated and those found guilty will face serious consequences.",
0.9999992629857246,"[{'score': 0.112206477245964, 'sentence': ""When dining at a restaurant, it's customary to leave a tip, but one particular amount added to a takeout order left the restaurant staff in utter bewilderment.""}, {'score': 0.03848340899729796, 'sentence': ""A regular customer of Luigi's Italian Bistro, known only as Mr. Smith, left a staggering $1,000 tip for his modest $30 meal.""}, {'score': 0.4949750207956165, 'sentence': 'The staff, who had been struggling due to the economic impact of the pandemic, were overjoyed.'}, {'score': 0.9219733734396854, 'sentence': ""Mr. Smith's generous act not only showed his appreciation for their culinary skills, but also his understanding of the tough times they were going through.""}, {'score': 0.0, 'sentence': 'This extraordinary tip became a beacon of hope amidst their difficulties.'}]","When dining at a restaurant, it's customary to leave a tip, but one particular amount added to a takeout order left the restaurant staff in utter bewilderment. A regular customer of Luigi's Italian Bistro, known only as Mr. Smith, left a staggering $1,000 tip for his modest $30 meal. The staff, who had been struggling due to the economic impact of the pandemic, were overjoyed. Mr. Smith's generous act not only showed his appreciation for their culinary skills, but also his understanding of the tough times they were going through. This extraordinary tip became a beacon of hope amidst their difficulties.",
0.9999992428850533,"[{'score': 0.9687613568085349, 'sentence': 'Less than two years ago, I was sitting at a South Atlantic League baseball game (Single-A, the lowest level of the minors), enjoying the raw energy of young hopefuls striving to make a name for themselves in the higher leagues.'}, {'score': 0.9119678800395112, 'sentence': ""The stadium was filled with the aroma of popcorn and hot dogs, the crowd's cheers echoing through the evening air.""}, {'score': 0.9949626868703567, 'sentence': 'There was an incredible sense of camaraderie among the spectators, sharing in the collective joy and anticipation.'}, {'score': 0.060880019725419676, 'sentence': 'As I watched these young players, their passion and dedication were palpable.'}, {'score': 0.9805494827666291, 'sentence': 'It was a stark reminder of the power of dreams and the determination required to pursue them.'}]","Less than two years ago, I was sitting at a South Atlantic League baseball game (Single-A, the lowest level of the minors), enjoying the raw energy of young hopefuls striving to make a name for themselves in the higher leagues. The stadium was filled with the aroma of popcorn and hot dogs, the crowd's cheers echoing through the evening air. There was an incredible sense of camaraderie among the spectators, sharing in the collective joy and anticipation. As I watched these young players, their passion and dedication were palpable. It was a stark reminder of the power of dreams and the determination required to pursue them.",
0.9977186531226229,"[{'score': 0.9893800496760603, 'sentence': 'November 17, 2015, 12:55 AM.'}, {'score': 0.0, 'sentence': 'Michael Höpner had to give up Manhattan street manners.'}, {'score': 7.781966368125559e-05, 'sentence': 'We realized that we were in a place where the commotion of high society was replaced by peaceful tranquility.'}, {'score': 8.031264266294968e-06, 'sentence': 'Michael Höpner, once a busy New York resident, had now moved to a small town in Vermont, exchanging skyscrapers for hills and car horns for birdsong.'}, {'score': 0.402998388080848, 'sentence': 'The pace of life was slower, people were kinder, and the environment more peaceful.'}, {'score': 0.2465221857647273, 'sentence': 'He was learning to adapt, to slow down, to breathe.'}, {'score': 0.9649796712868343, 'sentence': 'It was a completely new way of life, but Michael was ready to accept it with all his heart.'}]","November 17, 2015, 12:55 AM. Michael Höpner had to give up Manhattan street manners. We realized that we were in a place where the commotion of high society was replaced by peaceful tranquility. Michael Höpner, once a busy New York resident, had now moved to a small town in Vermont, exchanging skyscrapers for hills and car horns for birdsong. The pace of life was slower, people were kinder, and the environment more peaceful. He was learning to adapt, to slow down, to breathe. It was a completely new way of life, but Michael was ready to accept it with all his heart.",
0.9999990538684735,"[{'score': 0.9848032459598712, 'sentence': 'A new survey shows that more Americans would choose the Internet as their sole news source over television, radio, or print newspapers.'}, {'score': 0.001017288275698247, 'sentence': 'The growing preference for online news sources reflects the digital age, where information is instantly and conveniently available.'}, {'score': 0.18151739505342823, 'sentence': 'This shift also points to a changing demographic, as younger generations rely more heavily on the Internet for news.'}, {'score': 0.9385908029768846, 'sentence': 'However, it also raises questions about the reliability of online news, as it often remains unregulated and susceptible to misinformation.'}, {'score': 0.740311160349818, 'sentence': 'This highlights the need for media literacy and critical thinking in the face of a changing information landscape.'}]","A new survey shows that more Americans would choose the Internet as their sole news source over television, radio, or print newspapers. The growing preference for online news sources reflects the digital age, where information is instantly and conveniently available. This shift also points to a changing demographic, as younger generations rely more heavily on the Internet for news. However, it also raises questions about the reliability of online news, as it often remains unregulated and susceptible to misinformation. This highlights the need for media literacy and critical thinking in the face of a changing information landscape.",
0.9999992591891764,"[{'score': 3.350827911807741e-07, 'sentence': 'The family travels to a remote island in southern Chile.'}, {'score': 0.9654724542337978, 'sentence': 'During the trip, they try to convince their grandmother and grandfather to leave their isolated home and move back to the city with them.'}, {'score': 3.3029012647123324e-07, 'sentence': 'The grandmother and grandfather initially resist, cherishing their peaceful way of life and the memories they have created on the island.'}, {'score': 0.2149544253402117, 'sentence': 'However, the family presents the difficulties of their advanced age, the benefits of modern conveniences, and the joy of being close to their grandchildren.'}, {'score': 0.21268153173715487, 'sentence': 'The grandmother and grandfather are torn, struggling to decide between the familiar comfort of their island home and the prospect of a supportive, family-oriented life in the city.'}]","The family travels to a remote island in southern Chile. During the trip, they try to convince their grandmother and grandfather to leave their isolated home and move back to the city with them. The grandmother and grandfather initially resist, cherishing their peaceful way of life and the memories they have created on the island. However, the family presents the difficulties of their advanced age, the benefits of modern conveniences, and the joy of being close to their grandchildren. The grandmother and grandfather are torn, struggling to decide between the familiar comfort of their island home and the prospect of a supportive, family-oriented life in the city.",
0.9723161060886318,"[{'score': 0.0, 'sentence': 'The Momtract from Mother New York gives privileges of command instead of flowers or cards.'}, {'score': 0.0, 'sentence': 'The advertising agency Mother New York has launched a unique product: Momtract.'}, {'score': 0.0, 'sentence': 'This innovative idea, instead of traditional gifts such as flowers or cards, gives mothers the privileges of command for a day.'}, {'score': 2.9668132196403185e-05, 'sentence': ""It's a fun, ironic approach to celebrating motherhood, allowing moms to truly enjoy the day by being in charge.""}, {'score': 3.980929591529403e-07, 'sentence': 'Momtract gives them the freedom to make decisions and take charge, providing a refreshing change from their usual daily duties.'}, {'score': 0.9613030596771108, 'sentence': ""It's a humorous, yet sincere way to show appreciation for the hard work they do every day.""}]","The Momtract from Mother New York gives privileges of command instead of flowers or cards. The advertising agency Mother New York has launched a unique product: Momtract. This innovative idea, instead of traditional gifts such as flowers or cards, gives mothers the privileges of command for a day. It's a fun, ironic approach to celebrating motherhood, allowing moms to truly enjoy the day by being in charge. Momtract gives them the freedom to make decisions and take charge, providing a refreshing change from their usual daily duties. It's a humorous, yet sincere way to show appreciation for the hard work they do every day.",
0.9999992427213413,"[{'score': 2.658675501976404e-10, 'sentence': 'The ABC TV political discussion program ""Insiders"" is coming to Byron Bay.'}, {'score': 4.743031461806879e-05, 'sentence': 'Host Barrie Cassidy will lead a visiting panel of experts through a thorough discussion of the latest developments in Australian politics.'}, {'score': 0.0592698838245449, 'sentence': 'The panel will include prominent political analysts, journalists, and former politicians.'}, {'score': 0.7156631415047443, 'sentence': 'They will delve into topics such as climate change policies, upcoming elections, and the overall political climate in Australia.'}, {'score': 0.9984370539375965, 'sentence': 'The audience will also have the opportunity to participate in the discussion, asking questions and sharing their perspectives.'}, {'score': 0.10290789148765289, 'sentence': 'This promises to be a thought-provoking and engaging evening program for anyone interested in Australian politics.'}]","The ABC TV political discussion program ""Insiders"" is coming to Byron Bay. Host Barrie Cassidy will lead a visiting panel of experts through a thorough discussion of the latest developments in Australian politics. The panel will include prominent political analysts, journalists, and former politicians. They will delve into topics such as climate change policies, upcoming elections, and the overall political climate in Australia. The audience will also have the opportunity to participate in the discussion, asking questions and sharing their perspectives. This promises to be a thought-provoking and engaging evening program for anyone interested in Australian politics.",
0.999997633275903,"[{'score': 0.0, 'sentence': 'Washington, July 31, 2018 / 15:01 ( ).'}, {'score': 0.8599076007848862, 'sentence': '- The Washington Metropolitan Area Transportation Administration has faced criticism for its recent decision to discontinue late-night service, which many believe will disproportionately affect low-wage workers who rely on public transportation.'}, {'score': 0.3609574719189106, 'sentence': 'Activists and community leaders have expressed their concerns, noting that many service industry, healthcare, and other sector workers often work non-traditional hours.'}, {'score': 0.2812434501323784, 'sentence': 'They argued that the reduction in service will not only cause them inconvenience but also potentially jeopardize their jobs.'}, {'score': 0.9405486927680429, 'sentence': 'The administration has yet to respond to these criticisms and is expected to review its decision.'}]","Washington, July 31, 2018 / 15:01 ( ). - The Washington Metropolitan Area Transportation Administration has faced criticism for its recent decision to discontinue late-night service, which many believe will disproportionately affect low-wage workers who rely on public transportation. Activists and community leaders have expressed their concerns, noting that many service industry, healthcare, and other sector workers often work non-traditional hours. They argued that the reduction in service will not only cause them inconvenience but also potentially jeopardize their jobs. The administration has yet to respond to these criticisms and is expected to review its decision.",
0.9997671170536323,"[{'score': 0.0, 'sentence': 'Can drainage pipes resolve the compact conflict?'}, {'score': 0.0, 'sentence': 'How can we get more water into the republican river?'}, {'score': 1.6198153929281034e-11, 'sentence': 'Can it be as simple as installing drainage pipes?'}, {'score': 0.0005876858048172728, 'sentence': 'These questions have sparked a discussion among environmentalists, engineers, and local authorities.'}, {'score': 0.0005877216543249686, 'sentence': 'Drainage pipes, unlike traditional irrigation methods, may potentially redirect water to areas where it is most needed, thereby reducing conflicts over water rights.'}, {'score': 0.992687758137314, 'sentence': 'However, the feasibility and environmental impact of this solution still need to be studied.'}, {'score': 0.9662070065957804, 'sentence': 'The challenge lies in providing a sustainable solution that respects the ecosystem and the rights of all parties involved.'}]","Can drainage pipes resolve the compact conflict? How can we get more water into the republican river? Can it be as simple as installing drainage pipes? These questions have sparked a discussion among environmentalists, engineers, and local authorities. Drainage pipes, unlike traditional irrigation methods, may potentially redirect water to areas where it is most needed, thereby reducing conflicts over water rights. However, the feasibility and environmental impact of this solution still need to be studied. The challenge lies in providing a sustainable solution that respects the ecosystem and the rights of all parties involved.",
0.9999986710125355,"[{'score': 0.9996697618080738, 'sentence': 'She grew up in a predominantly white, working-class neighborhood.'}, {'score': 0.9281404649072347, 'sentence': '""We were the only Asian family in our area,"" she recalled.'}, {'score': 0.6801844522532074, 'sentence': 'The feeling of isolation was overwhelming, but it also served as a catalyst for her resilience.'}, {'score': 0.9440079791410707, 'sentence': 'From a young age, she learned to navigate the complex landscape of cultural diversity.'}, {'score': 0.2995240105042759, 'sentence': 'Her experiences of racial discrimination and social class division were formative, turning her into a strong advocate for multiculturalism and social justice.'}, {'score': 0.9837430349565357, 'sentence': 'She was determined to make her mark, challenge the norm, and create space for those who found themselves in similar situations.'}]","She grew up in a predominantly white, working-class neighborhood. ""We were the only Asian family in our area,"" she recalled. The feeling of isolation was overwhelming, but it also served as a catalyst for her resilience. From a young age, she learned to navigate the complex landscape of cultural diversity. Her experiences of racial discrimination and social class division were formative, turning her into a strong advocate for multiculturalism and social justice. She was determined to make her mark, challenge the norm, and create space for those who found themselves in similar situations.",
0.9999992413009214,"[{'score': 3.740048715172861e-09, 'sentence': 'Ben Finkelhor, MBA 04, executive director of the Energy Efficiency Center (EEC), will present the GSM Business Leader series lecturer, Jane Thompson, a renowned environmentalist and advocate for sustainable business practices.'}, {'score': 0.9447396055546564, 'sentence': 'Thompson, with over two decades of experience in the energy sector, will share her insights on integrating sustainability into business models.'}, {'score': 0.0013711511088996264, 'sentence': 'She will discuss the challenges and opportunities of green business, offering a fresh perspective on reducing environmental footprint while maximizing profitability.'}, {'score': 0.008349759272897939, 'sentence': 'Finkelhor is eager to facilitate this enlightening conversation, hoping to inspire attendees to consider the role of sustainability in their own business ventures.'}]","Ben Finkelhor, MBA 04, executive director of the Energy Efficiency Center (EEC), will present the GSM Business Leader series lecturer, Jane Thompson, a renowned environmentalist and advocate for sustainable business practices. Thompson, with over two decades of experience in the energy sector, will share her insights on integrating sustainability into business models. She will discuss the challenges and opportunities of green business, offering a fresh perspective on reducing environmental footprint while maximizing profitability. Finkelhor is eager to facilitate this enlightening conversation, hoping to inspire attendees to consider the role of sustainability in their own business ventures.",
0.9999556022100906,"[{'score': 0.933353020835869, 'sentence': 'Former Representative Stephanie Herseth Sandlin (D-SD) is eager to start her work on K Street and does not rule out the possibility of a future return to politics.'}, {'score': 0.7652101111272555, 'sentence': 'Sandlin, who recently took a position at a prominent lobbying firm, believes that her experience in agricultural policy and Native American affairs will be beneficial to her new role.'}, {'score': 0.9759103320620631, 'sentence': ""She plans to utilize her knowledge to influence policy-making, as well as to advocate for her clients' interests.""}, {'score': 0.9402640396795182, 'sentence': 'Although she is focused on her current position, she acknowledges that the dynamic nature of politics is appealing and she may potentially explore the possibility of running for office again in the future.'}]","Former Representative Stephanie Herseth Sandlin (D-SD) is eager to start her work on K Street and does not rule out the possibility of a future return to politics. Sandlin, who recently took a position at a prominent lobbying firm, believes that her experience in agricultural policy and Native American affairs will be beneficial to her new role. She plans to utilize her knowledge to influence policy-making, as well as to advocate for her clients' interests. Although she is focused on her current position, she acknowledges that the dynamic nature of politics is appealing and she may potentially explore the possibility of running for office again in the future.",
0.9999870023398273,"[{'score': 4.897281462923342e-05, 'sentence': 'She posted information about Bozeman in the Facebook group ""In and Around Troy, Illinois"" to see if anyone had seen him.'}, {'score': 0.0018223381056822197, 'sentence': 'The response was overwhelming.'}, {'score': 0.007681953312730694, 'sentence': 'Residents, many of whom had never met Bozeman, shared observations and tips about his usual haunts.'}, {'score': 4.440892098500626e-16, 'sentence': 'Some even offered to join the search, eager to help bring the beloved local back home.'}, {'score': 0.9861861732584897, 'sentence': 'A sense of community was truly felt as people came together to support each other.'}, {'score': 5.707585044523178e-05, 'sentence': 'It served as a touching reminder of the kindness and solidarity that exists in small-town life in Troy.'}]","She posted information about Bozeman in the Facebook group ""In and Around Troy, Illinois"" to see if anyone had seen him. The response was overwhelming. Residents, many of whom had never met Bozeman, shared observations and tips about his usual haunts. Some even offered to join the search, eager to help bring the beloved local back home. A sense of community was truly felt as people came together to support each other. It served as a touching reminder of the kindness and solidarity that exists in small-town life in Troy.",
0.9999992495073929,"[{'score': 0.999949122457692, 'sentence': 'Former Chicago police officer Jason Van Dyke was sentenced on Friday to six years and nine months for the murder of 17-year-old Laquan McDonald, marking the end of a high-profile trial that highlighted issues of racial bias and police brutality.'}, {'score': 0.9895747032703801, 'sentence': 'Van Dyke, who was convicted of second-degree murder and 16 counts of aggravated battery, shot McDonald 16 times in October 2014.'}, {'score': 0.9984482238511453, 'sentence': 'The sentence has sparked mixed reactions, with some considering it too lenient and others seeing it as a step towards justice.'}, {'score': 0.960127394044347, 'sentence': 'Despite the verdict, the case continues to fuel discussions about police conduct and racial discrimination in America.'}]","Former Chicago police officer Jason Van Dyke was sentenced on Friday to six years and nine months for the murder of 17-year-old Laquan McDonald, marking the end of a high-profile trial that highlighted issues of racial bias and police brutality. Van Dyke, who was convicted of second-degree murder and 16 counts of aggravated battery, shot McDonald 16 times in October 2014. The sentence has sparked mixed reactions, with some considering it too lenient and others seeing it as a step towards justice. Despite the verdict, the case continues to fuel discussions about police conduct and racial discrimination in America.",
0.9999951414512941,"[{'score': 0.0, 'sentence': 'There is no stronger motivation to forget past grievances than ratings and upcoming contract negotiations.'}, {'score': 0.028658349923547433, 'sentence': 'High above Midtown Manhattan, television executives gathered in their glass skyscrapers, discussing the future of their biggest stars.'}, {'score': 4.888815229753263e-06, 'sentence': 'The tension is high as they calculate the potential impact of each decision on viewership and advertising revenue.'}, {'score': 0.9295813077739596, 'sentence': ""It's a ruthless game of chess, where personal differences must be set aside for the greater good of the network.""}, {'score': 0.038966319876319155, 'sentence': ""Amidst the skyscrapers and chaos, the eternal adage remains true - there's no business like show business.""}]","There is no stronger motivation to forget past grievances than ratings and upcoming contract negotiations. High above Midtown Manhattan, television executives gathered in their glass skyscrapers, discussing the future of their biggest stars. The tension is high as they calculate the potential impact of each decision on viewership and advertising revenue. It's a ruthless game of chess, where personal differences must be set aside for the greater good of the network. Amidst the skyscrapers and chaos, the eternal adage remains true - there's no business like show business.",
0.9999990253398404,"[{'score': 0.001394630083160986, 'sentence': 'There are numerous products that allow for the creation of playable content demos, but most lack the simplicity and user-friendly interface that beginners desire.'}, {'score': 1.449111231011102e-08, 'sentence': 'Many require a steep learning curve or technical expertise that can intimidate new users.'}, {'score': 0.13928326906059396, 'sentence': 'However, some innovative companies are breaking this trend by offering easy-to-use platforms with intuitive controls and straightforward instructions.'}, {'score': 0.46665522920007674, 'sentence': 'These platforms are designed for those who may not have experience in the tech sphere but still want to create engaging and high-quality playable demos.'}, {'score': 0.9859630594304437, 'sentence': 'They have managed to strike a balance between advanced features and ease of use.'}]","There are numerous products that allow for the creation of playable content demos, but most lack the simplicity and user-friendly interface that beginners desire. Many require a steep learning curve or technical expertise that can intimidate new users. However, some innovative companies are breaking this trend by offering easy-to-use platforms with intuitive controls and straightforward instructions. These platforms are designed for those who may not have experience in the tech sphere but still want to create engaging and high-quality playable demos. They have managed to strike a balance between advanced features and ease of use.",
