score,sentence_scores,text,error
0.9999990922511592,"[{'score': 5.6582865060050835e-09, 'sentence': 'Central American referee Carlos Batres fell for the worst simulation of the World Cup, committed by the most theatrical Italian forward, Vincenzo Montella.'}, {'score': 1.484047666877597e-05, 'sentence': 'In a scandalous match, Batres awarded a penalty to Italy in the 89th minute after Montella dramatically fell in the penalty area.'}, {'score': 0.09447566271140784, 'sentence': ""The replay clearly showed the absence of contact with the opposing team's player, which caused outrage among the opposing team and fans around the world.""}, {'score': 0.008858501346275527, 'sentence': ""Batres' decision seemed to be more influenced by Montella's theatrics than an actual foul, casting a shadow over what would have otherwise been an interesting match.""}, {'score': 1.6524914405735558e-06, 'sentence': 'This incident once again raised questions about the role of VAR in football.'}]","Central American referee Carlos Batres fell for the worst simulation of the World Cup, committed by the most theatrical Italian forward, Vincenzo Montella. In a scandalous match, Batres awarded a penalty to Italy in the 89th minute after Montella dramatically fell in the penalty area. The replay clearly showed the absence of contact with the opposing team's player, which caused outrage among the opposing team and fans around the world. Batres' decision seemed to be more influenced by Montella's theatrics than an actual foul, casting a shadow over what would have otherwise been an interesting match. This incident once again raised questions about the role of VAR in football.",
0.999997324782606,"[{'score': 0.005008967561161093, 'sentence': 'The market for data processing centers in Russia continues to grow.'}, {'score': 0.020714148328346726, 'sentence': 'It is enough to look at the significant growth of investments and the number of facilities under construction.'}, {'score': 0.004095801739400384, 'sentence': ""This growth is driven by various factors, including advancements in cloud technology, increased digitalization of business, and Russia's aspiration for data sovereignty.""}, {'score': 0.930513833981218, 'sentence': 'Various global tech giants are expanding their presence in the country, and local companies are also ramping up the capacity of their data processing centers.'}, {'score': 0.6617781658933551, 'sentence': ""As the need for data consumption and storage increases, a growth in demand for reliable and secure data processing centers is expected, which will contribute to the market's continuous growth.""}]","The market for data processing centers in Russia continues to grow. It is enough to look at the significant growth of investments and the number of facilities under construction. This growth is driven by various factors, including advancements in cloud technology, increased digitalization of business, and Russia's aspiration for data sovereignty. Various global tech giants are expanding their presence in the country, and local companies are also ramping up the capacity of their data processing centers. As the need for data consumption and storage increases, a growth in demand for reliable and secure data processing centers is expected, which will contribute to the market's continuous growth.",
0.017786679305429542,"[{'score': 0.884210553450336, 'sentence': 'December 25 (Reuters) - The Saudi market fell on Tuesday as plummeting oil prices put pressure on petrochemical stocks and financial shares.'}, {'score': 0.9833258622285559, 'sentence': ""The Tadawul All Share Index, Saudi Arabia's benchmark, dropped 1.9%, led by a 3.5% decline in Saudi Basic Industries Corp (SABIC), the world's fourth-largest petrochemicals producer.""}, {'score': 2.905064534930446e-06, 'sentence': 'Al Rajhi Bank also saw a 1.2% decline.'}, {'score': 0.98611251104296, 'sentence': 'This market downturn is largely attributed to the global decline in oil prices, which negatively affects the profitability of petrochemical companies and, consequently, the overall state of the Saudi economy.'}]","December 25 (Reuters) - The Saudi market fell on Tuesday as plummeting oil prices put pressure on petrochemical stocks and financial shares. The Tadawul All Share Index, Saudi Arabia's benchmark, dropped 1.9%, led by a 3.5% decline in Saudi Basic Industries Corp (SABIC), the world's fourth-largest petrochemicals producer. Al Rajhi Bank also saw a 1.2% decline. This market downturn is largely attributed to the global decline in oil prices, which negatively affects the profitability of petrochemical companies and, consequently, the overall state of the Saudi economy.",
0.9999297742807779,"[{'score': 0.9826044919211216, 'sentence': 'WASHINGTON -- An Iowa egg producer at the center of a nationwide salmonella outbreak apologized to a congressional committee on Thursday, expressing deep regret over an incident that sickened thousands of people across the country.'}, {'score': 0.9783500715385068, 'sentence': ""The company's CEO, visibly shaken, promised to make necessary changes to ensure that a similar incident does not happen again.""}, {'score': 0.0082798202145824, 'sentence': 'He promised to implement strict safety measures, improve working conditions, and invest in regular sanitary inspections.'}, {'score': 0.8829292690791928, 'sentence': 'The CEO also promised to fully cooperate with state agencies in any ongoing investigations, acknowledging the severity of the public health crisis caused by the outbreak and the need for accountability in the food industry.'}]","WASHINGTON -- An Iowa egg producer at the center of a nationwide salmonella outbreak apologized to a congressional committee on Thursday, expressing deep regret over an incident that sickened thousands of people across the country. The company's CEO, visibly shaken, promised to make necessary changes to ensure that a similar incident does not happen again. He promised to implement strict safety measures, improve working conditions, and invest in regular sanitary inspections. The CEO also promised to fully cooperate with state agencies in any ongoing investigations, acknowledging the severity of the public health crisis caused by the outbreak and the need for accountability in the food industry.",
0.9998392915041986,"[{'score': 0.9993965123895869, 'sentence': ""TOKYO (AFP) - Nearly half of Tokyo's residents were unable to name a single Paralympian or international sports event, according to a survey conducted by the Organizing Committee of the Olympic and Paralympic Games in Tokyo.""}, {'score': 0.9315472071162826, 'sentence': 'The survey showed that 46% of respondents did not know a single Paralympic athlete, reflecting a lack of recognition and media coverage of athletes with disabilities in Japan.'}, {'score': 0.7684186992375024, 'sentence': 'While the 2020 Tokyo Paralympics aimed to highlight and promote inclusivity in sports, the results indicate a need to strengthen efforts to raise awareness and understanding of Paralympic sports and athletes in the country.'}]","TOKYO (AFP) - Nearly half of Tokyo's residents were unable to name a single Paralympian or international sports event, according to a survey conducted by the Organizing Committee of the Olympic and Paralympic Games in Tokyo. The survey showed that 46% of respondents did not know a single Paralympic athlete, reflecting a lack of recognition and media coverage of athletes with disabilities in Japan. While the 2020 Tokyo Paralympics aimed to highlight and promote inclusivity in sports, the results indicate a need to strengthen efforts to raise awareness and understanding of Paralympic sports and athletes in the country.",
0.8422551940914721,"[{'score': 0.8252136926207464, 'sentence': ""Edgar Wright has never made a bad film, he hasn't even made anything other than a very good film.""}, {'score': 0.9468313005619745, 'sentence': 'His unique directorial style, characterized by fast-paced editing, quirky humor, and visually stunning action sequences, consistently sets him apart from his contemporaries.'}, {'score': 0.9985855733720042, 'sentence': 'His films, from cult classics like ""Shaun of the Dead"" and ""Hot Fuzz"" to later works like ""Baby Driver"", have always received critical acclaim and commercial success.'}, {'score': 0.18851254076288848, 'sentence': ""Wright's innovative storytelling and his impeccable attention to detail make each of his films a unique cinematic experience.""}]","Edgar Wright has never made a bad film, he hasn't even made anything other than a very good film. His unique directorial style, characterized by fast-paced editing, quirky humor, and visually stunning action sequences, consistently sets him apart from his contemporaries. His films, from cult classics like ""Shaun of the Dead"" and ""Hot Fuzz"" to later works like ""Baby Driver"", have always received critical acclaim and commercial success. Wright's innovative storytelling and his impeccable attention to detail make each of his films a unique cinematic experience.",
0.9999988523654938,"[{'score': 0.07347191526228392, 'sentence': 'The palm tree is illuminated with lights in anticipation of the Christmas season in Charleston, South Carolina.'}, {'score': 0.0, 'sentence': 'Spend a coastal Christmas in this charming Southern city.'}, {'score': 6.190004064876575e-10, 'sentence': 'Traditional holiday decorations blend seamlessly with the unique charm of the coastal region.'}, {'score': 0.04622500221052528, 'sentence': 'Take a stroll down the cobblestone streets, warmly wrapped up against the crisp ocean air.'}, {'score': 0.9231090500926601, 'sentence': 'The twinkling lights of the palm tree are reflected in the calm waters, creating a mesmerizing sight.'}, {'score': 1.7004490907579495e-06, 'sentence': 'Explore the cozy local shops in search of unique gifts and indulge in festive treats.'}, {'score': 0.0, 'sentence': 'A coastal Christmas in Charleston truly offers a unique and magical holiday experience.'}]","The palm tree is illuminated with lights in anticipation of the Christmas season in Charleston, South Carolina. Spend a coastal Christmas in this charming Southern city. Traditional holiday decorations blend seamlessly with the unique charm of the coastal region. Take a stroll down the cobblestone streets, warmly wrapped up against the crisp ocean air. The twinkling lights of the palm tree are reflected in the calm waters, creating a mesmerizing sight. Explore the cozy local shops in search of unique gifts and indulge in festive treats. A coastal Christmas in Charleston truly offers a unique and magical holiday experience.",
0.8124352596634257,"[{'score': 0.0, 'sentence': '151 - 200 businesses Add your business and get famous - For free.'}, {'score': 0.0, 'sentence': 'We love DRYING and it shows in our service offerings.'}, {'score': 0.7574511288492067, 'sentence': ""Whether you're a small shop or a large corporation, we take care of all types of businesses with our comprehensive drying solutions.""}, {'score': 0.7840445023679256, 'sentence': 'Our team of experts is always ready to help you with your drying needs, ensuring the smooth operation of your operations.'}, {'score': 0.9968731915977399, 'sentence': 'We are committed to providing high-quality services and achieving customer satisfaction.'}, {'score': 0.0, 'sentence': 'Trust us for reliable, efficient, and affordable drying solutions.'}, {'score': 0.00011384153249427431, 'sentence': 'Register your business with us today and feel the difference.'}]","151 - 200 businesses Add your business and get famous - For free. We love DRYING and it shows in our service offerings. Whether you're a small shop or a large corporation, we take care of all types of businesses with our comprehensive drying solutions. Our team of experts is always ready to help you with your drying needs, ensuring the smooth operation of your operations. We are committed to providing high-quality services and achieving customer satisfaction. Trust us for reliable, efficient, and affordable drying solutions. Register your business with us today and feel the difference.",
0.9999992361640193,"[{'score': 0.9995814533720697, 'sentence': 'Quetta - At least eleven people, including two women and two children, have been killed, and 18 others injured in a road accident near Quetta, the capital of Balochistan.'}, {'score': 0.09059136929549028, 'sentence': 'The horrific incident occurred when a passenger bus collided with a truck on the Quetta-Sibi highway.'}, {'score': 0.7683261956478393, 'sentence': 'Local authorities and rescue teams promptly arrived at the scene, providing immediate medical aid to the injured.'}, {'score': 0.9994407436770847, 'sentence': 'The wounded were rushed to nearby hospitals, where they are receiving treatment.'}, {'score': 0.9998877233760796, 'sentence': 'The cause of the accident has not been determined yet, and an investigation is underway.'}, {'score': 0.4890600024345365, 'sentence': 'The local government has expressed condolences and promised to provide sufficient support to the affected families.'}]","Quetta - At least eleven people, including two women and two children, have been killed, and 18 others injured in a road accident near Quetta, the capital of Balochistan. The horrific incident occurred when a passenger bus collided with a truck on the Quetta-Sibi highway. Local authorities and rescue teams promptly arrived at the scene, providing immediate medical aid to the injured. The wounded were rushed to nearby hospitals, where they are receiving treatment. The cause of the accident has not been determined yet, and an investigation is underway. The local government has expressed condolences and promised to provide sufficient support to the affected families.",
0.9959687606144519,"[{'score': 0.48150168143741623, 'sentence': 'Everyone knows where they were and what they were doing when that nightmare situation known as 9/11 occurred.'}, {'score': 0.9025501478082827, 'sentence': 'Chuck was getting ready for his morning class at New York University.'}, {'score': 0.9936139245308349, 'sentence': 'The news of the attacks hit him like a ton of bricks.'}, {'score': 0.9991904898035068, 'sentence': 'He felt a chill run down his spine as he watched the horrific scene unfolding on the TV in his dorm room.'}, {'score': 0.07710899341470134, 'sentence': 'His city, his home, was under attack.'}, {'score': 0.0, 'sentence': 'The routine of a typical Patterson day quickly turned to fear and uncertainty.'}, {'score': 0.9994682592678866, 'sentence': 'His mind was filled with worries about his family, friends, and the future of his beloved city.'}]","Everyone knows where they were and what they were doing when that nightmare situation known as 9/11 occurred. Chuck was getting ready for his morning class at New York University. The news of the attacks hit him like a ton of bricks. He felt a chill run down his spine as he watched the horrific scene unfolding on the TV in his dorm room. His city, his home, was under attack. The routine of a typical Patterson day quickly turned to fear and uncertainty. His mind was filled with worries about his family, friends, and the future of his beloved city.",
0.9999990629694104,"[{'score': 0.8722894851720006, 'sentence': 'When I arrived to meet Bono at the bar in his hotel, I spotted Richard Gere sitting at a corner table, engrossed in a novel.'}, {'score': 0.06889524923454338, 'sentence': 'The atmosphere was casual, yet had an air of star-studded exclusivity.'}, {'score': 0.010819469266445725, 'sentence': 'Bono stood at the bar, energetically discussing global issues with a journalist from a leading magazine.'}, {'score': 6.661338147750939e-16, 'sentence': 'His charismatic aura filled the room.'}, {'score': 0.0007805002497732749, 'sentence': 'I approached him, my heart racing with nervous excitement.'}, {'score': 0.7447333997735068, 'sentence': 'Richard Gere glanced up at me from his book, his piercing gaze adding to the intensity of the moment.'}, {'score': 0.9901952765463681, 'sentence': 'It was a world far removed from my ordinary life, a world of fame, glamour, and thought-provoking conversations.'}]","When I arrived to meet Bono at the bar in his hotel, I spotted Richard Gere sitting at a corner table, engrossed in a novel. The atmosphere was casual, yet had an air of star-studded exclusivity. Bono stood at the bar, energetically discussing global issues with a journalist from a leading magazine. His charismatic aura filled the room. I approached him, my heart racing with nervous excitement. Richard Gere glanced up at me from his book, his piercing gaze adding to the intensity of the moment. It was a world far removed from my ordinary life, a world of fame, glamour, and thought-provoking conversations.",
0.9967006210651203,"[{'score': 0.9900079050775001, 'sentence': 'OMAHA, Neb.'}, {'score': 0.930280696879788, 'sentence': '– Nebraska basketball player Deverell Biggs has been charged with suspicion of driving under the influence and leaving the scene of an accident.'}, {'score': 0.9953247567005508, 'sentence': 'The incident occurred late Saturday evening, when Biggs reportedly lost control of his vehicle and crashed into a parked car.'}, {'score': 3.6159075511577043e-08, 'sentence': 'The basketball player allegedly left the scene without reporting it.'}, {'score': 0.9948978585648203, 'sentence': 'He was later found and arrested by the Omaha Police Department.'}, {'score': 0.9989942660788139, 'sentence': ""The university's athletic department is aware of the situation and will be handling it internally.""}, {'score': 8.457525901839347e-09, 'sentence': ""Biggs' status for upcoming games is currently uncertain.""}]","OMAHA, Neb. – Nebraska basketball player Deverell Biggs has been charged with suspicion of driving under the influence and leaving the scene of an accident. The incident occurred late Saturday evening, when Biggs reportedly lost control of his vehicle and crashed into a parked car. The basketball player allegedly left the scene without reporting it. He was later found and arrested by the Omaha Police Department. The university's athletic department is aware of the situation and will be handling it internally. Biggs' status for upcoming games is currently uncertain.",
0.9999991720322051,"[{'score': 0.052079098306011984, 'sentence': ""Let's stop trying to label them and just be happy.""}, {'score': 0.6426212950383527, 'sentence': ""Okay, I'll just say it: they're unique, they're special, and they're not here to fit into our biased perceptions or expectations.""}, {'score': 0.9987532236997471, 'sentence': ""They're here to live their life to the fullest, in their own unique way, and we should respect and appreciate that.""}, {'score': 2.7872424479546964e-08, 'sentence': ""Let's stop worrying about squeezing them into frames and just accept their individuality.""}, {'score': 0.0014531381753758454, 'sentence': ""Let's celebrate their diversity and their courage to be themselves.""}, {'score': 0.937894378678244, 'sentence': ""After all, it's their differences that make them so extraordinary.""}]","Let's stop trying to label them and just be happy. Okay, I'll just say it: they're unique, they're special, and they're not here to fit into our biased perceptions or expectations. They're here to live their life to the fullest, in their own unique way, and we should respect and appreciate that. Let's stop worrying about squeezing them into frames and just accept their individuality. Let's celebrate their diversity and their courage to be themselves. After all, it's their differences that make them so extraordinary.",
0.9999989267332203,"[{'score': 0.009016853171655903, 'sentence': 'A new emblem to help define how the community views the Seminole County school system is soon to be developed by a local design firm.'}, {'score': 0.0002861357126010544, 'sentence': 'This initiative aims to visually represent the sentiments of students, parents, staff, and residents towards the school system.'}, {'score': 4.621299040996618e-06, 'sentence': 'The design process will involve consulting with these stakeholders to ensure an accurate reflection of their perceptions and wishes in the logo.'}, {'score': 0.5706820873170281, 'sentence': ""This undertaking seeks not only to enhance the school system's brand identity but also to foster a sense of unity and pride within the community.""}, {'score': 0.9991730252232324, 'sentence': 'The final design is expected to be unveiled by the end of the school year.'}]","A new emblem to help define how the community views the Seminole County school system is soon to be developed by a local design firm. This initiative aims to visually represent the sentiments of students, parents, staff, and residents towards the school system. The design process will involve consulting with these stakeholders to ensure an accurate reflection of their perceptions and wishes in the logo. This undertaking seeks not only to enhance the school system's brand identity but also to foster a sense of unity and pride within the community. The final design is expected to be unveiled by the end of the school year.",
0.9999990040213006,"[{'score': 0.9726926995825773, 'sentence': ""In a rare instance, Dhoni, who wasn't even supposed to be on the field, found himself in the role of an unexpected hero.""}, {'score': 0.9948681632207723, 'sentence': 'Initially, he was called in to replace an injured player.'}, {'score': 0.9968117022973292, 'sentence': 'However, as the game progressed, it became clear that his contribution was invaluable.'}, {'score': 0.7274682705654676, 'sentence': 'With his strategic thinking, Dhoni was able to guide his team to victory.'}, {'score': 0.976660972043252, 'sentence': ""His performance was a testament to his adaptability and determination, proving that sometimes it's the most unlikely circumstances that bring out the best in us.""}]","In a rare instance, Dhoni, who wasn't even supposed to be on the field, found himself in the role of an unexpected hero. Initially, he was called in to replace an injured player. However, as the game progressed, it became clear that his contribution was invaluable. With his strategic thinking, Dhoni was able to guide his team to victory. His performance was a testament to his adaptability and determination, proving that sometimes it's the most unlikely circumstances that bring out the best in us.",
0.9999992470831958,"[{'score': 0.9997085921572715, 'sentence': ""It's enough to give you a headache.""}, {'score': 0.5356008750932701, 'sentence': ""Mastering all the intricacies of Obamacare's open enrollment can be overwhelming, given the vast array of options and information to sift through.""}, {'score': 0.9364077248982652, 'sentence': ""From understanding the various insurance plans, premiums, and deductibles to determining whether you're eligible for a subsidy or not, the process can be complicated and confusing.""}, {'score': 0.3853328715050396, 'sentence': ""It's crucial to take the time, do your research, and consider seeking help from a healthcare specialist or a trusted insurance agent.""}, {'score': 0.9929102042538164, 'sentence': 'Remember, the goal is to find a healthcare program that best fits your needs and budget.'}]","It's enough to give you a headache. Mastering all the intricacies of Obamacare's open enrollment can be overwhelming, given the vast array of options and information to sift through. From understanding the various insurance plans, premiums, and deductibles to determining whether you're eligible for a subsidy or not, the process can be complicated and confusing. It's crucial to take the time, do your research, and consider seeking help from a healthcare specialist or a trusted insurance agent. Remember, the goal is to find a healthcare program that best fits your needs and budget.",
0.9999989376373213,"[{'score': 3.643980511625067e-05, 'sentence': 'A member of the county and district council from Exminster, Councillor Ian Hall, has spoken out in support of the recently proposed local development plan.'}, {'score': 0.004146881647828615, 'sentence': ""Councillor Hall believes that the plan's emphasis on sustainable growth and community development is crucial for Exminster's future.""}, {'score': 0.9463814401384594, 'sentence': '""The plan offers a balanced approach to growth, recognizing the need for new housing and infrastructure, while also preserving the unique character and environment of our town,"" he said.'}, {'score': 0.2746780520954285, 'sentence': 'He also highlighted the job creation and economic stimulation opportunities that the plan could bring, urging his constituents to consider its long-term benefits.'}]","A member of the county and district council from Exminster, Councillor Ian Hall, has spoken out in support of the recently proposed local development plan. Councillor Hall believes that the plan's emphasis on sustainable growth and community development is crucial for Exminster's future. ""The plan offers a balanced approach to growth, recognizing the need for new housing and infrastructure, while also preserving the unique character and environment of our town,"" he said. He also highlighted the job creation and economic stimulation opportunities that the plan could bring, urging his constituents to consider its long-term benefits.",
