score,sentence_scores,text,error
0.9999992478800217,"[{'score': 0.9889770920293357, 'sentence': 'The Messiah (also known as the Mashiach) is the long-awaited Jewish leader who will bring an era of peace, enlightenment, and universal brotherhood.'}, {'score': 0.9928871265875675, 'sentence': 'This period, as predicted in Jewish writings, will be marked by the restoration of the Temple in Jerusalem, the gathering of all Jews back to the Land of Israel, and the end of all forms of suffering and evil.'}, {'score': 0.08046070713907316, 'sentence': 'It is believed that during this era, knowledge of God will permeate every corner of the world, uprooting ignorance and injustice.'}, {'score': 1.2194210810001493e-05, 'sentence': 'The coming of the Mashiach symbolizes hope for a future marked by harmony, unity, and divine wisdom.'}]","The Messiah (also known as the Mashiach) is the long-awaited Jewish leader who will bring an era of peace, enlightenment, and universal brotherhood. This period, as predicted in Jewish writings, will be marked by the restoration of the Temple in Jerusalem, the gathering of all Jews back to the Land of Israel, and the end of all forms of suffering and evil. It is believed that during this era, knowledge of God will permeate every corner of the world, uprooting ignorance and injustice. The coming of the Mashiach symbolizes hope for a future marked by harmony, unity, and divine wisdom.",
0.9999992255005732,"[{'score': 0.005298184410297613, 'sentence': 'The study suggests that complex behaviors were transmitted over tens of thousands of years.'}, {'score': 0.9668651414204533, 'sentence': 'Despite intensive scientific research, no concrete evidence has been found to support this theory.'}, {'score': 0.7902738976853466, 'sentence': 'However, a recent study provides compelling data that suggests certain complex behaviors, such as tool-making and social hierarchy, may have indeed been transmitted across generations over tens of thousands of years.'}, {'score': 0.9939347070159833, 'sentence': 'This may indicate that our ancestors were more sophisticated than previously thought, and challenges long-held assumptions about the evolution of human behavior.'}, {'score': 0.9528306326236526, 'sentence': 'This discovery also opens up new avenues for exploring the origins of human culture and cognitive abilities.'}]","The study suggests that complex behaviors were transmitted over tens of thousands of years. Despite intensive scientific research, no concrete evidence has been found to support this theory. However, a recent study provides compelling data that suggests certain complex behaviors, such as tool-making and social hierarchy, may have indeed been transmitted across generations over tens of thousands of years. This may indicate that our ancestors were more sophisticated than previously thought, and challenges long-held assumptions about the evolution of human behavior. This discovery also opens up new avenues for exploring the origins of human culture and cognitive abilities.",
0.9999990253362702,"[{'score': 0.9979151510984683, 'sentence': 'Senator Martha McSally has called on the Secretaries of the Army, Navy, and Air Force, as well as universities, to explore the potential for implementing advanced technologies and artificial intelligence in their operations.'}, {'score': 0.05481870166586322, 'sentence': 'She emphasized the importance of modernizing military tactics and strategies to strengthen national security.'}, {'score': 0.9923686059181209, 'sentence': 'Senator McSally also urged universities to include more technology and artificial intelligence-based courses in their curricula, as she believes that future generations should be equipped with the necessary skills and knowledge to operate in an increasingly digital world.'}, {'score': 0.9965116330795296, 'sentence': 'She also stressed the need for strategic partnerships between the military, academia, and the technology industry to drive innovation.'}]","Senator Martha McSally has called on the Secretaries of the Army, Navy, and Air Force, as well as universities, to explore the potential for implementing advanced technologies and artificial intelligence in their operations. She emphasized the importance of modernizing military tactics and strategies to strengthen national security. Senator McSally also urged universities to include more technology and artificial intelligence-based courses in their curricula, as she believes that future generations should be equipped with the necessary skills and knowledge to operate in an increasingly digital world. She also stressed the need for strategic partnerships between the military, academia, and the technology industry to drive innovation.",
0.999999181726268,"[{'score': 0.0, 'sentence': 'Contiki launched its European campaign ""Manny Makes Contiki"", featuring their hottest new star, Manny the mannequin.'}, {'score': 0.0, 'sentence': 'The campaign shows Manny experiencing various European destinations and participating in the most typical activities offered by Contiki.'}, {'score': 1.7033388630904867e-05, 'sentence': 'From gondola rides in Venice to parties in Ibiza, Manny is portrayed as someone who takes on everything the tour operator has to offer.'}, {'score': 0.7342405041269491, 'sentence': 'The goal of the campaign is to inspire young travelers to explore Europe and take on new experiences.'}, {'score': 0.0, 'sentence': ""Through Manny's adventures, Contiki aims to highlight the fun, flexibility, and unique experiences that their tours offer.""}]","Contiki launched its European campaign ""Manny Makes Contiki"", featuring their hottest new star, Manny the mannequin. The campaign shows Manny experiencing various European destinations and participating in the most typical activities offered by Contiki. From gondola rides in Venice to parties in Ibiza, Manny is portrayed as someone who takes on everything the tour operator has to offer. The goal of the campaign is to inspire young travelers to explore Europe and take on new experiences. Through Manny's adventures, Contiki aims to highlight the fun, flexibility, and unique experiences that their tours offer.",
0.9999987186929625,"[{'score': 0.9034651011022677, 'sentence': 'The yield on US government debt rose on Friday after the US government stated that job creation in April was stronger than expected.'}, {'score': 0.34898739633785614, 'sentence': 'The Labor Department reported that 263,000 new jobs were added, significantly exceeding the forecasted 190,000.'}, {'score': 0.44579034703347853, 'sentence': 'This positive economic news led to an increase in investor confidence, causing bond yields to rise.'}, {'score': 0.9997132598022991, 'sentence': 'The yield on 10-year Treasury bonds, which moves inversely to price, rose to 2.6% from 2.5%.'}, {'score': 0.997097951775161, 'sentence': 'The yield on 2-year bonds also increased to 2.3% from 2.2%.'}, {'score': 0.8763576000662406, 'sentence': 'The strong employment data suggests a healthy economy, reducing the likelihood of a cut in interest rates by the Federal Reserve in the near future.'}]","The yield on US government debt rose on Friday after the US government stated that job creation in April was stronger than expected. The Labor Department reported that 263,000 new jobs were added, significantly exceeding the forecasted 190,000. This positive economic news led to an increase in investor confidence, causing bond yields to rise. The yield on 10-year Treasury bonds, which moves inversely to price, rose to 2.6% from 2.5%. The yield on 2-year bonds also increased to 2.3% from 2.2%. The strong employment data suggests a healthy economy, reducing the likelihood of a cut in interest rates by the Federal Reserve in the near future.",
0.9946374051690657,"[{'score': 6.668073027071841e-08, 'sentence': 'This is general clerical and secretarial work performed in a school.'}, {'score': 3.9479530755670567e-13, 'sentence': 'An employee in this category performs routine and varied office operations that require general office skills.'}, {'score': 0.7864202638494466, 'sentence': 'Tasks may include word processing, record-keeping, answering phone calls, scheduling meetings, managing supplies, and preparing reports.'}, {'score': 0.42988858958523535, 'sentence': 'The employee must be able to perform multiple tasks simultaneously and work with interruptions while maintaining attention to detail.'}, {'score': 0.9595880453901308, 'sentence': 'They are often the first point of contact for students, parents, and visitors, so require excellent communication skills.'}, {'score': 0.9469113717383595, 'sentence': 'They also provide support to teachers, administrators, and other school staff, ensuring a smooth and efficient operation in the school environment.'}]","This is general clerical and secretarial work performed in a school. An employee in this category performs routine and varied office operations that require general office skills. Tasks may include word processing, record-keeping, answering phone calls, scheduling meetings, managing supplies, and preparing reports. The employee must be able to perform multiple tasks simultaneously and work with interruptions while maintaining attention to detail. They are often the first point of contact for students, parents, and visitors, so require excellent communication skills. They also provide support to teachers, administrators, and other school staff, ensuring a smooth and efficient operation in the school environment.",
0.9992575328301427,"[{'score': 0.9998637203227894, 'sentence': 'AUGUSTA, Maine (AP) — The Maine Warden Service says the body of a hunter has been found in a forest near Augusta, marking the first hunting-related death of the season.'}, {'score': 0.9998188134674882, 'sentence': 'The deceased, identified as 57-year-old Robert Johnson, was reported missing by his family after he failed to return home from a hunting trip.'}, {'score': 0.98362479391434, 'sentence': 'His body was discovered early Wednesday morning by a search party.'}, {'score': 0.9990146223533015, 'sentence': 'Preliminary investigations suggest Johnson may have died of natural causes, although the exact cause of death is still being determined.'}, {'score': 0.9224402561410497, 'sentence': 'The Maine Warden Service is urging hunters to ensure they are in good health before embarking on hunting trips.'}]","AUGUSTA, Maine (AP) — The Maine Warden Service says the body of a hunter has been found in a forest near Augusta, marking the first hunting-related death of the season. The deceased, identified as 57-year-old Robert Johnson, was reported missing by his family after he failed to return home from a hunting trip. His body was discovered early Wednesday morning by a search party. Preliminary investigations suggest Johnson may have died of natural causes, although the exact cause of death is still being determined. The Maine Warden Service is urging hunters to ensure they are in good health before embarking on hunting trips.",
0.9999960896442397,"[{'score': 0.9999085846884119, 'sentence': 'An American Civil Liberties Union attorney asked a federal appeals court in San Francisco today to block a California law that allows law enforcement agencies to collect DNA samples from people who have been arrested but not yet convicted of a serious crime.'}, {'score': 0.9999073178089687, 'sentence': 'The attorney argued that the law violates the Fourth Amendment, which protects citizens from unreasonable searches and seizures.'}, {'score': 0.8951398081175939, 'sentence': ""The ACLU claims that taking DNA samples without a conviction violates people's right to privacy and could lead to the misuse of sensitive genetic information.""}, {'score': 0.174851104881536, 'sentence': 'This practice, in their view, presumes guilt before innocence, undermining a fundamental principle of the American justice system.'}]","An American Civil Liberties Union attorney asked a federal appeals court in San Francisco today to block a California law that allows law enforcement agencies to collect DNA samples from people who have been arrested but not yet convicted of a serious crime. The attorney argued that the law violates the Fourth Amendment, which protects citizens from unreasonable searches and seizures. The ACLU claims that taking DNA samples without a conviction violates people's right to privacy and could lead to the misuse of sensitive genetic information. This practice, in their view, presumes guilt before innocence, undermining a fundamental principle of the American justice system.",
0.9999992726697874,"[{'score': 0.3664212331523362, 'sentence': ""Pharmaceutical giant Pfizer exceeded Wall Street expectations for the third quarter, but one phrase uttered by CEO Ian Read drew particular attention: he hinted at a possible separation of the company's established and innovative businesses.""}, {'score': 2.3784973990359504e-11, 'sentence': 'Read suggested that such a separation would allow each division to focus on its own strengths and growth strategies.'}, {'score': 0.37056722076197357, 'sentence': 'The established business would focus on generic and off-patent drugs, while the innovative division would be responsible for developing new drugs.'}, {'score': 6.5390277250720885e-06, 'sentence': ""This strategy could potentially maximize profits and increase Pfizer's dominance in the market.""}, {'score': 0.2818279457521168, 'sentence': ""However, the proposed separation has raised questions about potential disruptions and uncertainties in the company's operations.""}]","Pharmaceutical giant Pfizer exceeded Wall Street expectations for the third quarter, but one phrase uttered by CEO Ian Read drew particular attention: he hinted at a possible separation of the company's established and innovative businesses. Read suggested that such a separation would allow each division to focus on its own strengths and growth strategies. The established business would focus on generic and off-patent drugs, while the innovative division would be responsible for developing new drugs. This strategy could potentially maximize profits and increase Pfizer's dominance in the market. However, the proposed separation has raised questions about potential disruptions and uncertainties in the company's operations.",
0.9999986068211484,"[{'score': 0.39346285315351004, 'sentence': 'San Rafael, California - Audio technology company Soundness is pleased to announce the availability of SoundSoap+ 5.0, the latest version of their award-winning audio software for cleaning.'}, {'score': 0.9623833210894172, 'sentence': 'This new version introduces advanced features that provide a higher level of control over audio restoration and enhancement, making it easier for users to remove unwanted background noise from audio files.'}, {'score': 0.9626746547276712, 'sentence': 'It is designed for both professionals and beginners, with an intuitive interface that simplifies the audio editing process.'}, {'score': 0.07353172919671092, 'sentence': 'SoundSoap+ 5.0 is compatible with Mac and Windows systems and is now available for purchase on the Soundness website.'}]","San Rafael, California - Audio technology company Soundness is pleased to announce the availability of SoundSoap+ 5.0, the latest version of their award-winning audio software for cleaning. This new version introduces advanced features that provide a higher level of control over audio restoration and enhancement, making it easier for users to remove unwanted background noise from audio files. It is designed for both professionals and beginners, with an intuitive interface that simplifies the audio editing process. SoundSoap+ 5.0 is compatible with Mac and Windows systems and is now available for purchase on the Soundness website.",
0.9999933586933649,"[{'score': 0.9760878870136597, 'sentence': ""A Frenchwoman who underwent the world's first partial face transplant showed off her new look to the public on Monday at a press conference in Lyon, France.""}, {'score': 0.6189322724149069, 'sentence': 'The woman, identified only as Isabelle, appeared confident and grateful as she spoke about the life-changing procedure.'}, {'score': 0.9890499395542278, 'sentence': 'The transplant, which included a new nose, mouth, and chin, has given her a second chance at a normal life.'}, {'score': 0.9988651404044538, 'sentence': '""I feel alive again,"" she said with a smile.'}, {'score': 0.10706574140342906, 'sentence': 'She thanked her team of surgeons for their skill and dedication, and expressed hope that her story would inspire others facing similar problems to consider this pioneering medical option.'}]","A Frenchwoman who underwent the world's first partial face transplant showed off her new look to the public on Monday at a press conference in Lyon, France. The woman, identified only as Isabelle, appeared confident and grateful as she spoke about the life-changing procedure. The transplant, which included a new nose, mouth, and chin, has given her a second chance at a normal life. ""I feel alive again,"" she said with a smile. She thanked her team of surgeons for their skill and dedication, and expressed hope that her story would inspire others facing similar problems to consider this pioneering medical option.",
0.9999992124209257,"[{'score': 0.9975405472417791, 'sentence': 'Up and down the East Coast, voters braved extremely cold weather in the pre-dawn twilight as they lined up to cast their ballots in one of the most significant elections in recent history.'}, {'score': 0.8752619241061588, 'sentence': 'Wrapped in coats, hats, and scarves, they were undeterred by the freezing temperatures.'}, {'score': 0.01721051865423917, 'sentence': 'A sense of urgency and civic duty was palpable among the diverse crowd.'}, {'score': 0.2577871546952517, 'sentence': 'Polling stations were bustling with activity as voters patiently waited their turn.'}, {'score': 0.9919532358093164, 'sentence': 'Despite the inclement weather, turnout was high, reflecting the deep commitment of citizens to participate in the democratic process, regardless of the obstacles they faced.'}]","Up and down the East Coast, voters braved extremely cold weather in the pre-dawn twilight as they lined up to cast their ballots in one of the most significant elections in recent history. Wrapped in coats, hats, and scarves, they were undeterred by the freezing temperatures. A sense of urgency and civic duty was palpable among the diverse crowd. Polling stations were bustling with activity as voters patiently waited their turn. Despite the inclement weather, turnout was high, reflecting the deep commitment of citizens to participate in the democratic process, regardless of the obstacles they faced.",
0.0009355819414532673,"[{'score': 2.220446049250313e-16, 'sentence': 'Exam week is here.'}, {'score': 0.00048784224205444815, 'sentence': 'We can help.'}, {'score': 0.1037297401297379, 'sentence': 'Thursday, December 6 at 3:00 PM: Zooniverse Project Seminar.'}, {'score': 0.9858576486678177, 'sentence': 'Learn how to navigate the vast world of this online platform that allows you to participate in scientific research.'}, {'score': 1.122647586493386e-05, 'sentence': 'Friday, December 7 at 2:00 PM: Learning Strategy Session.'}, {'score': 0.04010721655624916, 'sentence': 'Get tips and tricks to improve your learning habits and ace your exams.'}, {'score': 0.0006235882760523559, 'sentence': 'Saturday, December 8 at 12:00 PM: Stress Relief Yoga.'}, {'score': 0.0, 'sentence': 'Take a break from textbooks and rejuvenate with calming yoga.'}, {'score': 0.9755919479365026, 'sentence': 'All events will be held at the Student Union.'}, {'score': 0.7764314620308366, 'sentence': ""Don't worry, we've got you covered this exam week!""}]","Exam week is here. We can help. Thursday, December 6 at 3:00 PM: Zooniverse Project Seminar. Learn how to navigate the vast world of this online platform that allows you to participate in scientific research. Friday, December 7 at 2:00 PM: Learning Strategy Session. Get tips and tricks to improve your learning habits and ace your exams. Saturday, December 8 at 12:00 PM: Stress Relief Yoga. Take a break from textbooks and rejuvenate with calming yoga. All events will be held at the Student Union. Don't worry, we've got you covered this exam week!",
0.9999991263481094,"[{'score': 0.9359283915071892, 'sentence': 'The overfilled cast of ""X-Men: Days of Future Past"" has gotten a bit smaller.'}, {'score': 0.9984790390070202, 'sentence': ""Although Anna Paquin's character, Rogue, was initially supposed to be featured in the film as one of the main characters, it has been confirmed that her scenes were cut from the final version.""}, {'score': 0.3310608121008022, 'sentence': ""Director Bryan Singer explained that the editing process led to this decision, as her character's storyline didn't harmonize with the rest of the plot.""}, {'score': 0.7092469217384354, 'sentence': ""However, fans of the character shouldn't despair, as Singer hinted that Paquin's scenes may still be included in a potential director's cut or in future X-Men films.""}]","The overfilled cast of ""X-Men: Days of Future Past"" has gotten a bit smaller. Although Anna Paquin's character, Rogue, was initially supposed to be featured in the film as one of the main characters, it has been confirmed that her scenes were cut from the final version. Director Bryan Singer explained that the editing process led to this decision, as her character's storyline didn't harmonize with the rest of the plot. However, fans of the character shouldn't despair, as Singer hinted that Paquin's scenes may still be included in a potential director's cut or in future X-Men films.",
0.9999892174088845,"[{'score': 0.010875380589003392, 'sentence': 'BASEL, Switzerland – Swiss pharmaceutical giant Roche Holding AG announced on Monday that it has received reports of 13 cases of unforeseen side effects from its recently released medication.'}, {'score': 0.9918004532932142, 'sentence': 'The adverse reactions, which include severe allergic reactions and gastrointestinal problems, have been reported by patients in various countries.'}, {'score': 1.2502576751671768e-10, 'sentence': 'Roche stated that it is currently thoroughly investigating these reports and closely collaborating with healthcare authorities to ensure patient safety.'}, {'score': 0.5785193374687008, 'sentence': 'The company urged anyone experiencing such side effects to immediately consult their doctor, and also reassured patients and medical professionals that it will take immediate action to address the issue.'}]","BASEL, Switzerland – Swiss pharmaceutical giant Roche Holding AG announced on Monday that it has received reports of 13 cases of unforeseen side effects from its recently released medication. The adverse reactions, which include severe allergic reactions and gastrointestinal problems, have been reported by patients in various countries. Roche stated that it is currently thoroughly investigating these reports and closely collaborating with healthcare authorities to ensure patient safety. The company urged anyone experiencing such side effects to immediately consult their doctor, and also reassured patients and medical professionals that it will take immediate action to address the issue.",
0.9999992227280102,"[{'score': 0.00027315230779800803, 'sentence': 'Can it last for years?'}, {'score': 0.08014397237206705, 'sentence': ""According to network experts' analysis, the massive mailing of the MyDoom worm, which started in January 2004, has the potential to continue for a long period due to its self-replicating nature.""}, {'score': 8.01581023779363e-14, 'sentence': 'The worm, mainly spread by email, compromises the security of infected systems, allowing for further spread.'}, {'score': 7.156968610932957e-05, 'sentence': 'Despite efforts to control its spread, the complexity of the MyDoom worm makes its complete eradication a challenging task.'}, {'score': 0.9985406963961416, 'sentence': 'Constant vigilance and the use of up-to-date antivirus software are crucial for individual users and businesses to protect their systems from this ongoing cyber threat.'}]","Can it last for years? According to network experts' analysis, the massive mailing of the MyDoom worm, which started in January 2004, has the potential to continue for a long period due to its self-replicating nature. The worm, mainly spread by email, compromises the security of infected systems, allowing for further spread. Despite efforts to control its spread, the complexity of the MyDoom worm makes its complete eradication a challenging task. Constant vigilance and the use of up-to-date antivirus software are crucial for individual users and businesses to protect their systems from this ongoing cyber threat.",
